,score,text,score_ideal
1010,0,no decision yet on the ecommerce major today said it is focused… sps®,
1011,1,just arrived. thank u,
1012,0,no decision yet on flipkart - the hindu,
1013,0,"flipkart rolls out ping, a social network with built in chat flipkart has launched a new service that...",
1014,1,"samsung new mobiles j5 &amp; j7 in available in flipkart stores 

huryy up..... book your's...!!!!!!!!!...",
1015,1,how to get an invite for if anyone can share one with me it wil be great,
1016,0,"flipkart announces ping, a social network that lets friends shop together
read more",
1017,1,"samsung new mobiles j5 &amp; j7 in available in flipkart stores 

huryy up..... book your's...!!!!!!!!!1...",
1018,1,"rt so proud to take to market! mobile, users and the redefining the future is what keeps us motivated.",
1019,0,yes got access,
1020,0,no decision yet on flipkart the ecommerce major today said it is focused on developing products for mo…,
1021,0,rt indian etailer  adds a new way to shop with friends,
1022,0,rt ping,
1023,0,dtn no decision yet on the ecommerce major today said it is focused on developin...,
1024,0,heads of adiquity and appiterate quit months after flipkart acquisition,
1025,-2,how many days you need for replacing an faulty mobile? why are you no accepting return of faulty mobile?,
1026,0,how flipkart's bansals splashed out on the iit-delhi network - the economic times,
1027,1,interesting read,
1028,1,3.2 ghz lga 2011 core i7-3930k processor is selling cheaper at inr 41900 today,
1029,0,flipkart ping brings social networking into online flipkart today announced its new service called '...,
1030,1,rt here's how  works,
1031,0,flipkart will now let you ‘ping’ your friends while shopping online  via igyaan.in,
1032,1,happy customers make us happy!,
1033,2,snapdeal makes me happy!!! i was happy to get my product delivered very quickly. within 2 days.. faster than any flipkart,
1034,0,"bags, wallets &amp; belts minimum 50% off  flipkart",
1035,0,ceos of flipkart acquired companies,
1036,1,new inititative to make better customer experience,
1037,0,rt flipkart ping allows users to chat and shop with their friends,
1038,0,invite please,
1039,1,every indian needs an opinion of 10 others to finalize the clothes. why not do that online? kudos,
1040,0,"no decision yet on flipkart august 25, 2015 at",
1041,0,flipkart launches ping. now shop with your friends via,
1042,0,flipkart will now let you ‘ping’ your friends while shopping online,
1043,-1,"rt rt shopping now is very isolated experience,  flipkart is bringing new product ca…",
1044,1,innovative,
1045,1,rt huge opportunity for online giants like,
1046,1,"od203697321065131300, i am still waiting for a refund for a cancelled order by flip kart",
1047,-1,same thing happened with another guy i know. ordered jbl got fake samsung,
1048,0,flipkart ping allows users to chat and shop with their friends.,
1049,1,congo winner,
1050,0,ram how much,
1051,0,"motherfucker. in order to activate the 4g airtel sim that flipkart provided with moto g - 3rd gen, i need to buy an airtel sim first.",
1052,0,flipping over acqui-hire in flipkart ceos of two start-ups acquired by resign,
1053,0,congo bro wish to be next,
1054,0,i shop on flipkart,
1055,0,flipkart ping brings social networking into online shopping,
1056,0,"flipkart launches in-app chat feature called ping today - the economic times 
cc",
1057,0,rt over the years   has shaped the e-commerce industry in india.  says,
1058,1,rt hey  this will be fun to share shopping ideas with you on  with  let's do it with …,
1059,1,"flipkart and adobe executives join hands with an angel to float platform for used cars, spinny via",
1060,0,rt flipkart will now let you 'ping' your friends while shopping online,
1061,1,rt  execs join hands with an angel to float platform for used cars-,
1062,0,"rt with flipkart holding its decision to go app only, do you think companies will revisit their app only strategy?",
1063,0,"flipkart launches ping, a new feature to socialise your shopping experience",
1064,0,flipkart will now let you ‘ping’ your friends while shopping flipkart has announced a social networkin...,
1065,1,"i have received my moto g 3rd gen!
thank you so much team!",
1066,0,rt we are at the launch of flipkart's consumer centric service,
1067,0,flipkart launches ping. now shop with your friends,
1068,0,rt,
1069,4,rt love shopping? love free vouchers? take our contest &amp; win gift vouchers from flipkart!,
1070,0,"fossil watches store online 

amazonin flipkart",
1071,0,"why flipkart, snapdeal, and ola are hiring ‘kenyans’ to run their race",
1072,1,"rt \novel that pokes fun at the genre without totally letting go of it.\""~jrob via""",
1073,0,online retail company  launches in-app chat feature called today - the economic times,
1074,0,will now let you ‘ping’ your friends while shopping online. is here!,
1075,0,ping in-app feature launched to let buyers chat while shopping,
1076,0,online  shopping company .com se buy karne se pahle please compare...,
1077,0,"read more about 
also do you have an invite?",
1078,0,"rt flipkart minimum 70% off on bags,wallets &amp; belts",
1079,1,"\novel that pokes fun at the genre without totally letting go of it.\""~jrob via""",
1080,-1,on fiction best-sellers..,
1081,1,on best selling titles..,
1082,0,today at rs 210,
1083,0,wireless mouse..,
1084,0,footwear for men &amp; women..,
1085,0,"totes, backpacks &amp; more..",
1086,-1,worst csrs ever... i am not buying any high value item from you anymore!!,
1087,0,i really wish  does this.,
1088,1,rt rt seems like flipkart is heeding customer sentiments -- …,
1089,0,rt rt flipkart will now let you 'ping' your friends while shopping online …,
1090,1,rt seems like  is heeding customer sentiments -- by putting its app plan on hold,
1091,0,rt ceos of acquired cos adiquity and appiterate quit flipkart,
1092,-1,hey  just got fake samsung earphones from you..i had ordered sennheiser ..order  od203684680374684700,
1093,0,"rt get sandisk extreme sdhc 32 gb class 10  below rs 1,000-",
1094,0,flipkart will now let you 'ping' your friends while shopping online,
1095,0,"flipkart minimum 70% off on bags,wallets &amp; belts",
1096,0,ceos of acquired cos adiquity and appiterate quit flipkart,
1097,0,flipkart puts app-only plans on hold.,
1098,-1,this is the second poor experience with apple products on  ... last yr  it was iphone 5c which was found,
1099,0,- spinn aviator 01 sandals for rs 499 only at flipkart,
1100,-1,iphone 6 plus bought 4rm   is dead within 55 days... will have to avoid  4 products..,
1101,-2,videocon guys useless false promises n lies noteven acknowledgement abt the pymt.cs exec800800800 sarath useless,
1102,0,4 stars \engaging,
1103,0,xiaomi mi 3 exclusivity teased by flipkart ahead of tuesday's launch -,
1104,0,want to exchange flipkart of rs.500 and i need  bms voucher of 800,
1105,0,inc42 flipkart puts app-only plans on hold. (via twitter,
1106,1,here's how  works,
1107,0,rt whats the logic behind this   64 gb costs less than,
1108,1,g.skill ripjawsx ddr3 8 gb (1 x 8 gb) pc (f3-12800cl10s-8gbxl) is selling cheaper at inr 3900 today,
1109,0,"thumbs up to you guys,just tried a sample order from uae wid u n  for 2 acs n tvs.u guys rock.ontime n ex service1",
1110,0,2 in 1 laptops extra 5% off from rs. 12815 cashback– flipkart,
1111,0,plz notice my effort &amp; creativity,
1112,0,"flipkart announces ping, a social network that lets friends shop together

read more …",
1113,0,ceo of strategic brands at  quits,
1114,0,"chief executives of two start-ups acquired by flipkart resign
marketing",
1115,1,trying out flipkart's ping and got to say i am impressed. definitely a well thought out feature not just a gimmick.,
1116,0,rt kyuki flipkart cod karne pe hume paise nahi deta,
1117,1,f&amp;d a520 wired speaker is selling cheaper at inr 2300 today,
1118,1,ddr2 2 gb pc dram (jm667qlu-2g) is selling cheaper at inr 1104 today,
1119,0,kyuki flipkart cod karne pe hume paise nahi deta,
1120,1,"rt here you go, tweeple! your 1st  you have won a rs.5k  voucher! ht…",
1121,0,congrats.,
1122,1,rt at best price ever offers here,
1123,2,"follow to win
kelloggsmuesli 
for this pic to win vouchers from flipkart!",
1124,2,\true talent for developing a believable,
1125,0,what's common &amp; ping! - a by  that lets together!,
1126,2,"rt follow to win
 
for this pic to win vouchers from flipkart!",
1127,1,xperia z ultra is selling cheaper at inr 13710 today,
1128,1,"flipkart and adobe executives join hands with an angel to float platform for used cars, for a long tim...",
1129,1,flipkart bpo inbound day shift for fresher - gurgaon  delhi  noida. new recruitment s in delhi noida gur...,
1130,0,"rt ceos of flipkart-acquihired startups appiterate and adlquity the ceos of appiterate and adiquity, startu...",
1131,0,rt  yeah! true across sectors including online classifieds,
1132,0,if it's social then you must be bringing sharing purchases or seeking friend's help in purchase within flipkart itself.,
1133,1,lucky you,
1134,0,rt  launches chat feature called inside its android and ios app. online shopping going the messaging way?,
1135,0,rt  will be invite only -,
1136,0,shopping becomes social with flipkart ping flipkart,
1137,2,"follow to win
 
for this pic to win vouchers from flipkart!",
1138,0,"ceos of flipkart-acquihired startups appiterate and adlquity the ceos of appiterate and adiquity, startu...",
1139,0,ceos of flipkart-acquihired startups appiterate and adlquity quit,
1140,1,esito sneakers is selling cheaper by 20% at inr 1099 today,
1141,0,"\prose is tight and simple...often absent from young adult\"" ~ new year book review""",
1142,0,"extra 25% off on bath, bed and more  upto 16% from &gt;&gt;",
1143,0,simult ordered 2acsnotherstuff4newhouse frm flipkart.excellent  del n inst within 1 week of payment.buckleup,
1144,1,"minimum 40% off on women's clothing (vero moda, only, ucb and other top brands) only on flipkart",
1145,1,galaxy tab 4 t231 tablet is selling cheaper at inr 12790 today,
1146,0,i wish to renew my flipkart first membership. how can i do so through your app? ... i only use the app for orders.,
1147,0,"buy moto e for rs.4,999   

get this",
1148,-1,"amazon, flipkart, other players wary of going the ‘app only’ way via",
1149,-1,"philosophy dictates not to let others judge you and your tastes. then introduces lord, hell no to that.",
1150,1,check out new range of  buy  best price exclusively on,
1151,0,can't wait to test out the new way of shopping experience with waiting for invite,
1152,-1,dont you miss me   by the way  congrats,
1153,3,rt thank you  for the awesome prize! great contest can't wait to use my  voucher!,
1154,-1,bt really disappointing service by you &amp; ur customer executives.they just keep on repeating same ans for arnd 1 hr of my talk,
1155,0,520 120 gb ssd internal hard drive (ssdsc2cw120a3k5) is selling cheaper at inr 6900 today,
1156,0,congorats,
1157,3,rt 2nd winner of the day  congratulations on winning a rs.5k  voucher! http…,
1158,0,rt  all set to make a strategic announcement.,
1159,0,wish to be,
1160,0,here's why flipkart has put its app-only plans on hold,
1161,2,oh wow hope to get lucky sssoonnn,
1162,0,hope you noticed me,
1163,0,"get sandisk extreme sdhc 32 gb class 10  below rs 1,000-",
1164,0,congrats !,
1165,0,flipkart ping allows users to chat and shop with their friends,
1166,0,"canvas xpress 2 priced at rs 5,999 goes on sale on flipkart on august 25",
1167,1,congooooooooo hope to win,
1168,1,"micromax canvas xpress 2  5999

post free ads on 99spr",
1169,0,deliver to the mentioned address.. it took 7 days for them to know this !!! unbelievable.. i was suppose to gift this product,
1170,0,congrts..,
1171,0,"rt hardik patel &lt;-discover reviews and compare prices from flipkart,amazon and snapdeal",
1172,0,- on 7th day after my order confirmation they cancelled my order without any confirmation with a stupid reason like we do not,
1173,0,"rt made in china &lt;-discover reviews and compare prices from flipkart,amazon and snapdeal",
1174,1,"rt happy wedding anniversary &lt;-discover reviews and compare prices from flipkart,amazon and snapde…",
1175,0,"rt 'indycar'   -&gt; discover flipkart offers, coupon codes at",
1176,3,unlocking  winner congratulations  enjoy your rs.5k voucher from,
1177,1,hi when will the white moto g 3rd gen 16gb variant be available on flipkart? please let me know. thanks,
1178,-1,"defect in 's web page.
\causal tops has wrong image.""",
1179,0,"rt fitbit india, fitbitin   -&gt; discover flipkart offers, coupon codes at",
1180,0,"rt snapdeal diaries, snapdealdiaries   -&gt; discover flipkart offers, coupon codes at",
1181,0,"rt 'hardik', 'mangalore' &amp; 'mileage'   -&gt; discover flipkart offers, coupon codes at",
1182,0,"rt is it a coincidence? when the markets fall, flipkart offers a special discount of 30% on my book",
1183,0,ceos of two start-ups acquired by flipkart quit,
1184,1,introducing stephen a graphic guide (english) is selling cheaper at inr 150 today …,
1185,0,weekly newsletter sector,
1186,0,when is it launching??????,
1187,0,yeah! true across sectors including online classifieds,
1188,0,"is it a coincidence? when the markets fall, flipkart offers a special discount of 30% on my book",
1189,1,introducing stephen a graphic guide (english) is selling cheaper at inr 150 today,
1190,0,"rt what flipkart &amp; other \unicorns\"" are seeing is the beginning of the end of the party.series \""c\"" \""d\"" investors will be…""",
1191,0,\engaging,
1192,0,10-20% off on fossil watches only on flipkart,
1193,1,"yourstoryco .flipkart, execs join hands with an angel to float platform for used …",
1194,1,"rt flipkart and adobe executives join hands with an angel to float platform for used cars, spinny",
1195,0,ping,
1196,1,will be interesting to see who is left and who gets acquired in 2 to 3 yrs from now.,
1197,1,"flipkart and adobe executives join hands with an angel to float platform for used cars, spinny (your story)",
1198,0,ceos of acquired cos adiquity and appiterate quit flipkart (medianama),
1199,0,"is there any other option than  to buy moto g3, coz   cc executives behaviour on queries is driving me nuts",
1200,-2,"nt once, twice same thng happened, incomplete order. ethr u ppl are fool aur u think othr r",
1201,1,"rt buy moto g (3rd gen) starting at rs.11,999  get extra 1% cashback by kataak.",
1202,0,"launched “ping” to engage u socially 
via",
1203,1,dropped the idea of becoming seller on  . thank you,
1204,1,".. recently i made few purchases, i've received yatra cashback coupon for 1 order, but haven't received for other 2 orders",
1205,0,ceos of acquired cos adiquity and appiterate quit flipkart via digital media in india - ...,
1206,0,flipkart reviewers are from some other planet. they always have been...,
1207,1,well to me it's all flipkart. while it's up to seller it doesn't make sense right? the final price is more than mrp.,
1208,0,rt get a flipkart voucher by following us &amp; sending a simple dm to register for,
1209,0,r u ppl educated? if u r thn thr shld one chapter on u only education can't make u gud person,
1210,1,".flipkart, execs join hands with an angel to float platform for used cars- myspinny…",
1211,-1,now that free money may be drying up we have stopped working on our utterly stupid ideas. -,
1212,-1,i am having an issue with a offer mentioned on the app for moto g3 and the executive i just spoke with for details. can you help?,
1213,1,gsb 450 re carton drill kit is selling cheaper at inr 2400 today,
1214,0,flipkart ping brings social networking into online shopping -,
1215,0,4* \engaging,
1216,0,i think it is flipkart's ethics of unfair practice. thnx 2 indian govt. u r in business,
1217,0,mam can you invite me too,
1218,0,"hi there, please could i get a press contact to ask about flipkart ping? thanks!",
1219,1,dura plus kadhai is selling cheaper at inr 1200 today,
1220,0,wedge mobile bluetooth standard keyboard is selling cheaper by 1% at inr 4290 today,
1221,-2,even animal have that much mind not to repeat mistakes after training. r u worse than them?,
1222,1,"flipkart and adobe executives join hands with an angel to float platform for used cars,…",
1223,1,execs join hands with an angel to float platform for used cars-,
1224,1,for this pic to win vouchers from flipkart!,
1225,0,how long will u go with kind of practice....,
1226,0,"pantaloons, 
amazon, 
snapdeal, 
jabong and 
flipkart sale over....

nse bse sale started ..flat 20%",
1227,2,if this practice make u rich not respectable person. sure u r not.,
1228,0,have some shame.,
1229,0,whatsapp inside an app - flipkart ping.,
1230,0,"rt not another vampire story~\quick dialog and punchy characters\"" via""",
1231,-2,waiting for soution of my 3 month old incomplete order again sent incomplete order.,
1232,1,comfy beanbags upto 65% – 85%  flipkart,
1233,0,ettech | flipkart ping allows users to chat and shop with their friends,
1234,1,gsb 10re impact driver is selling cheaper at inr 1908 today,
1235,0,"rt flipkart … i'll have what your copywriter is smoking, guys",
1236,0,imadari ki aadat nai ya chori hi rahti hai niyat me hamesha,
1237,-1,sorry about this. please raise a return via logging into your flipkart account... will take it up from there.,
1238,2,"rt win rakhi special  gift vouchers worth rs 500 each contest!

contest rules coming up!!",
1239,1,sniper gym &amp; fitness gloves (xl) is selling cheaper at inr 979 today,
1240,0,minimum 50% off on branded watches for men and women on flipkart,
1241,0,again half product sent.,
1242,1,photron stedy pro 520 is selling cheaper at inr 1399 today,
1243,1,bombay dyeing cotton printed double bedsheet is selling cheaper at inr 1199 today,
1244,0,no need for an invite just update ur app,
1245,1,speeder tetron ii sneakers is selling cheaper by 21% at inr 1388 today,
1246,1,surely there were better options than 'ping' for a social networking feature !,
1247,1,"grandmother \that boy should have said he liked her...\""""",
1248,0,usb cables..,
1249,1,"buy moto g (3rd gen) starting at rs.11,999  get extra 1% cashback by kataak.",
1250,0,"rt flipkart's punit soni says it has over 50 million registered users for its app, who spend an average of 59 minutes every mont…",
1251,1,"flipkart and adobe executives join hands with an angel to float platform for used cars, spinny …",
1252,1,triangular ball pen is selling cheaper at inr 119 today,
1253,-1,rt new feature on flipkart app let's you chat with ur friends so that both of you can feel frustrated simultaneously.,
1254,2,fans - his new book relases today. available in india on &amp; from,
1255,-1,regarding missed pickups,
1256,0,"ping provides a collaborative shopping experience offering users socializing, purchasing &amp; native experiences within flipkart app.",
1257,0,"hi nidhi, will you please share an invite with me ? my mail id",
1258,2,rt bid unique and lowest to buy flipkart voucher worth rs.1000 at incredibly low price from,
1259,1,"blockbuster feature idea for   
pre select time so 1 doesn't need to tweet 100 times",
1260,1,zs-bty52 speaker is selling cheaper at inr 8180 today,
1261,1,xperia z3 is selling cheaper at inr 35990 today,
1262,1,"for an avid online shopper!
…",
1263,0,joyo - 125 -1800 ml plastic food storage  299,
1264,1,"honor powerbank 13000 mah (dual usb, 2a output) for rs. 1,399 - …",
1265,0,rt rajiv mangla to take over as … …,
1266,2,"making an award entry for hope my agency win it 
…",
1267,0,samsung galaxy j5 lowest price at rs.11999 flipkart samsung galaxy j5 price in india,
1268,0,my friends dont use flipkart only i use it if u dont arrange for my invitation i will also uninstall the app,
1269,2,bid unique and lowest to buy flipkart voucher worth rs.1000 at incredibly low price from,
1270,1,"rt 32gb samsung galaxy s6 available for pre order at flipkart

pre order it",
1271,1,ping will help you seek solicit quick feedback or getting assurance while shopping on flipkart app,
1272,0,rt  introduces a whole new way of shopping- social shopping!! shop with your friends,
1273,0,flipkart acquires two startup’s ceo’s!!,
1274,0,flipkart launches in-app chat feature called ping today,
1275,0,flipkart resign acquires two startup’s ceo’s!!,
1276,0,ys making sense of flipkart’s and snapdeal’s valuations through their gmv,
1277,1,"don't be like  ,  . what gives?",
1278,0,sylvia takes on eighth grade &amp; her sister's boyfriend ~not another vampire story ~,
1279,0,atleast you should atleast help your sellers too...their problems...,
1280,1,rt whole of that description by  of new flipkart messaging service worth reading. first,
1281,0,"what flipkart &amp; other \unicorns\"" are seeing is the beginning of the end of the party.series \""c\"" \""d\"" investors will be left holding the bag""",
1282,0,send me an invite  or 9892393192,
1283,0,rt chief executives of two acquired by flipkart resign rt,
1284,0,only,
1285,0,samsung galaxy j7 at lowest price rs.14999 flipkart galaxy j7 price in india,
1286,1,whole of that description by  of new flipkart messaging service worth reading. first,
1287,1,"rt asus zenfone 2-ze551 ml

available  kgn_computers (  ) 

our price 
flipkart price",
1288,2,maybe like myntra one can share his wishlist and likes with friends.,
1289,1,awesome. will do for sure. love therapy!,
1290,0,flipkart launches in-app chat feature called ping today -,
1291,0,"8th grade girl's life of school, 4* \engaging",
1292,0,flipkart deal of the day,
1293,0,"rt pantaloons, amazon, snapdeal, jabong and flipkart sale over....
nse bse sale started ..flat 20% off",
1294,0,indian co  keeps app-only plan on hold to assess impact on in big-ticket categories,
1295,0,its invite only. help send me one.,
1296,0,rt rajiv mangla to take over as …,
1297,1,decorate your home this festive season! upto 60% extra 20% off on home decor! …,
1298,2,making an award entry for hope my agency win it,
1299,1,sanyo eneloop hr-3utgb2btm rechargeable battery is selling cheaper at inr 360 today …,
1300,1,for an avid online shopper!,
1301,1,zenfone 4 is selling cheaper by 14% at inr 6038 today,
1302,0,"rt pre order samsung galaxy s6 at rs. 57,900
order",
1303,1,"honor powerbank 13000 mah (dual usb, 2a output) for rs. 1,399 -",
1304,2,l 'oreal paris white perfect laser day - spf 19 is selling cheaper by 2% at inr 875 to…,
1305,1,- laserjet m1005 multi-function laser printer is selling cheaper by 49% at inr 6500 toda…,
1306,1,sanyo eneloop hr-3utgb2btm rechargeable battery is selling cheaper at inr 360 today,
1307,1,ping will help you seek solicit quick feedback or getting assurance while shopping on flipkart app.,
1308,0,"got vampire? not another vampire story~\quick dialog and punchy characters\""""",
1309,1,"hi, can i also get invite ? would like to try flipkart ping .",
1310,1,"as i wrote in april, focus is a precious resource that flipkart is frittering away. the curse of easy vc money.",
1311,0,rt heard at a table nxt to me  - we'r leaving  engineering team. attended  mobilesparks grt …,
1312,0,"ping provides a collaborative shopping experience offering users socializing, purchasing &amp; native experiences in flipkart app.",
1313,1,"the incredibles, all for india
new range of asus zenfone
• zenfone selfie
13mp camera with dual led real tone flas…",
1314,0,did the same with me to deliver a laptop table!,
1315,0,5 star not another vampire story,
1316,0,"because all these were only \rumours\""",
1317,0,"flipkart has revealed a new feature called ping, which will allow you to shop with your friends. essentially, it...",
1318,2,l 'oreal paris white perfect laser day - spf 19 is selling cheaper by 2% at inr 875 today,
1319,0,hi i have bought a phone from flipkart around 3 months back its battery is heating up abnormally,
1320,0,flipkart offer the team that made a reality. here’s to more social shoppin…,
1321,1,- laserjet m1005 multi-function laser printer is selling cheaper by 49% at inr 6500 today,
1322,1,share &amp; relive your favorite memories with buy at  -,
1323,2,"5*  \omg i love this book i've read it like 7 times this week\"" via""",
1324,0,how do i get the invitation,
1325,0,"chief executives of two start-ups acquired by flipkart resign.
anurag dod, head of advertising technology firm...",
1326,1,rt win rs 500 flipkart gift voucher. tell us what is  in less than 9 words.,
1327,1,"rt flipkart has developed ping that would consume less data, less battery and will work on any smartphone working on android 2.1…",
1328,1,rt the ui looks as if fb messenger has been integrated into flipkart. complete with chatheads.,
1329,0,launches - a social shopping enabler  also read  comment at end *fingers crossed*,
1330,0,so what have you got for us?,
1331,0,hey  just sent you an invite to access check it out and help me shop,
1332,0,that's wonderful. congrats team,
1333,0,"not another vampire story~\quick dialog and punchy characters\"" via""",
1334,0,delhi government has become flipkart. it only offers discounts these days.,
1335,2,benq xl2411z 24 inch led backlit lcd monitor (gaming) is selling cheaper at inr 24999 today,
1336,0,rt flipkart ping will initially be invite only.,
1337,0,buy micromax canvas xpress 2 online at rs 5999 – flipkart sale (today at 12pm),
1338,1,valueram ddr3 2 gb pc dram is selling cheaper at inr 990 today,
1339,0,rt essentially most of the new flipkart features and innovations will happen for mobile devices.,
1340,2,ya..snapdeal good btw not better as  .. bcoz snapdeal costs r quite high,
1341,0,new slogan of  app since the last update!,
1342,1,happy shopping days! get instant 5% on all orders at with any banks debit cards -,
1343,0,okkk in house shopping going on ab samajh aaya flipkart profit me kyu nai aata...hehehehe,
1344,0,"'hardik', 'mangalore' &amp; 'mileage'   -&gt; discover flipkart offers, coupon codes at",
