,score,text,score_ideal
677,0,flipkart launches new feature 'ping',
678,0,"rt   -&gt; discover flipkart offers, coupon codes at",
679,0,"rt smashwords and flipkart to end distribution relationship - amazon scores victory. in your opinion, is this good... http…",
680,0,my favourite shopping site,
681,1,bricks and more - wheels is selling cheaper at inr 893 today,
682,0,ordered lenovo a6000 which was expected to deliver by but not yet reached... can i expect any explanation ?,
683,2,cooler master k281 mid tower cabinet is selling cheaper at inr 4350 today,
684,1,"rt  useful for those who are already using  , i was not interested initially but after  demo’ed, …",
685,1,when you are out delivering a cod worth 13k the least you can do is send a notification or call and inform!,
686,0,"'tayaar', 'agle', 'aurora' &amp; 'borealis'   -&gt; discover flipkart offers, coupon codes at",
687,0,"baggit, baggitworld   -&gt; discover flipkart offers, coupon codes at",
688,0,explorer a310e  74% off on and is not expected to reduce further in next couple of months.,
689,0,"i plcd an order frm flipkart, order no.\od203440014332970000\\ in parcel i rcvd""",
690,1,very excited team,
691,1,"can never beat the likes of flipkart or amazon's take a week to deliver a used product, and another week to refund!",
692,0,"my  answer to flipkart, snapdeal, paytm are not earning profits from their ecommerce part. what are their exit…",
693,0,my  answer to what is the minimum product requirement to sell on flipkart?,
694,0,3,
695,0,"flipkart has launched a new feature called ping, that allows users to chat with their friends while shopping within the mobile app.",
696,0,rt nikon india withdraws its consumer advisory against flipkart and snapdeal,
697,0,buy elixir arts matte laminated &amp; framed and posters available on flipkart.,
698,0,"smashwords and flipkart to end distribution relationship, by mark coker, including letter to jeff bezos",
699,1,"launching of ‘ flipkart one stop ’ flipkart ping for sellers , for efficient results even on…",
700,0,i am in!!,
701,0,i want to buy your one plus 2 invite got from ola for rs. flipkart amazon voucher. interested?,
702,0,"plcd an order frm flipkart, order no.\od203440014332970000\\ in parcel i rcvd brick.""",
703,1,pentax efina plus point &amp; shoot camera is selling cheaper at inr 3400 today,
704,0,biggest festival ever! are you up for it?,
705,0,"f&amp;d multimedia speaker at 50% off rs 1349  here  
rs 2079 
rs 2078",
706,-1,court adjourns hearing on plea against nikon's flipkart advisory notice - ndtv,
707,-1,"rt swipe elite(black, 16 gb, rs. 5999) features and price - flipkart | go shopping mart",
708,1,denver black.code edp - 50 ml (for men) is selling cheaper at inr 164 today,
709,0,"\flipkart deals &amp; discount coupons\\""
4735""",
710,0,flipkart keeps its app-only plan on hold to assess how it will impact sales in big-ticket categories,
711,0,rt \in the us,
712,0,"rt whatever be your wish, go bananas!",
713,1,airport express base station wireless router is selling cheaper at inr 6479 today,
714,0,rt book msg the messenger dvd online at,
715,0,please look into it,
716,-1,"received tiles in place ofsolution from flipkart against order no od203550289234107500. after having 20 days of fraud delivery, no solutio",
717,0,"rt flipkart blends social with shopping, launches ping for messaging",
718,1,"zte blade buzz v815w (white, 512 mb) is selling cheaper at inr 2399 today",
719,1,the zen drawing pack (hardcover) is selling cheaper at inr 1063 today,
720,0,"exxoninc premium flip cover case for micromax yureka yu yureka ao5510 mobile w
via",
721,1,kdp select is destroying the book industry.if u are kind enough to do so -please buy my ebooks from smashwords.,
722,-1,"accidentally placed an order. can't cancel it, some issue with login. please cancel my order and confirm.
od003745076715051700",
723,1,"evolve (games, ps4) is selling cheaper at inr 1595 today",
724,0,"vivaa printed georgette women's kaftan - buy white vivaa printed georgette wom
via",
725,1,strontium microsd card 32 gb 70 class 10 nitro is selling cheaper at inr 799 today,
726,0,awesome!!,
727,1,"lol! thats finny... however, they showed a fantastic demo yesterday",
728,1,"xperia m (purple, 4 gb) is selling cheaper at inr 1490 today",
729,0,"rt flipkarts ping is here !
share the screen,ask for expert feedback
   htt…",
730,0,how to participate,
731,0,flipkart ping lets you go on an online shopping spree with your friends,
732,1,awesome,
733,0,"flipkart ping lets you chat with your friends in the app, shop for a product and discuss it with your friends,...",
734,1,"desire 500 dual sim (glacier blue, 4 gb) is selling cheaper at inr 13999 today",
735,0,most of the back covers and all the flip covers are out of stock.  sucks.,
736,1,"mini machines 5 pack (yellow, black) is selling cheaper at inr 629 today",
737,0,7.1 surround noise cancellation laptop headset (black) is selling cheaper at inr 500 today,
738,1,good jys will switch to android for flipkart ping,
739,1,"oneplus one (sandstone black, 64 gb) is selling cheaper at inr 21800 today",
740,0,"flyte mp3 store is more, but the the mix by you gave away for free is epic trippy music. belated thanks!",
741,1,sling urban photo 250 camera bag is selling cheaper at inr 3499 today,
742,0,no doubt 'that green shirt' demo was impressive,
743,0,flipkart’s new ‘f qck’ hyperlocal service to deliver order,
744,0,damn excited for it,
745,0,here’s an invite,
746,1,stag ninja fire table tennis racquet is selling cheaper at inr 1670 today,
747,1,winners of contest?,
748,0,waiting for it,
749,1,"jst bought moto g 3rd gen via  and delivery date is 29 aug, it's my birthday.. now it's like i'm getting a present frm myself.",
750,0,how to take part in this contest? contest,
751,-1,anyone need invites for !! revert back. only 10 invites !!,
752,2,"rt  why top are leaving like flipkart, snapdeal, ola &amp; others",
753,0,the delivery cost of  is more than the cost of buying the book from,
754,1,plantronics voyager legend bluetooth headset is selling cheaper at inr 3999 today,
755,2,i don't want a refund i just want a replacement of a better quality product,
756,0,"\shrinking interactions with the founders coupled with decreased influence on impactful decisions\\""
5365""",
757,0,"of an invincible man who refused to give up, \god walks my dreams\\""
5536""",
758,0,"\flipkart deals &amp; discount coupons\\""
6033""",
759,0,"'conferencing', 'cctns' &amp; 'fireproof'   -&gt; discover flipkart offers, coupon codes at",
760,1,rt    its a great start to inculcate social feature in flipkart app. great start,
761,0,flipkart launched a new in-app feature for real time chatting -,
762,1,rt received it yesterday. it's no longer working. great service,
763,0,if possible do on goodreads or if you bought it from amazon or flipkart.,
764,2,"why top executives are leaving startups like flipkart, ola and snapdeal",
765,2,"rt why top executives are leaving startups like flipkart, ola and snapdeal",
766,1,hp8309 hair straightener is selling cheaper at inr 1256 today,
767,0,nikon india withdraws its consumer advisory against flipkart and snapdeal,
768,1,on flipkart's humble beginnings and market expansion.,
769,3,"actually pretty impressed with flipkart ping. good job, folks.",
770,0,i am in,
771,-1,funky half shade aviators..go grab them at,
772,1,universal car clip mobile holde is selling cheaper at inr 105 today,
773,0,"rt in the next flipkart pings it, paytm banks it &amp; china crashes it! awesome fun, insights with",
774,0,hi team i ordered a phone lenovo a6000 plus.. and i am using it.. but it problems comes out... it didn't work well..,
775,1,"for rs. at for more like this, do come to",
776,1,finally uber promo code worth 800rs is out! uber800free,
777,0,when will be moto g3 in stock again on flipkart.,
778,0,flipkart ping lets you go on an online shopping spree with your friends,
779,0,"nikon withdraws flipkart, snapdeal names from caution notice",
780,0,ordered mobile 3 times got defective products 3 times. what is the guarantee you give for future orders.,
781,1,smashwords and flipkart to end distribution relationship ? amazon scores victory,
782,3,ping looks like a great product from  looking forward to more innovation from the recently hired tech leaders,
783,1,pulse bluetooth speaker is selling cheaper at inr 6500 today,
784,1,"16gb for rs. at for more like this, do come to",
785,1,rt on flipkart's humble beginnings and market expansion.,
786,0,"'pragati', 'alison' &amp; 'parker'   -&gt; discover flipkart offers, coupon codes at",
787,0,"'virginia'   -&gt; discover flipkart offers, coupon codes at",
788,0,soon we will see exclusive flash sale of cars on,
789,0,"rt nikon withdraws flipkart, snapdeal names from caution notice",
790,0,"my entire khaandaan uses the same flipkart account, just to save money on  flipkart first. no use of",
791,0,level 2 elements resistance tube is selling cheaper at inr 1199 today,
792,2,good to see all sellers of jalandhar one platform against ekl. this will helpful for all and flipkart too.,
793,0,"the 'a' word

click link to choose to buy the book from amazon, flipkart and many more.",
794,0,get fastrack white analog watch for women for rs. 402 - snapdeal,
795,1,flipkart ping work aahuthaa..?!,
796,0,"rt f&amp;d multimedia speaker at 50% off rs 1349  here  
rs 2079 
…",
797,1,online free flipkart dod samsung microsdhc 32 gb at 749,
798,0,send an invite?,
799,0,"rt 
pro et701 tablet at 41% off buy for rs 3499 on  here 
go",
800,0,flipkart vs amazon vs snapdeal affiliate marketing in india via,
801,-1,all lies always takes customer for ride,
802,2,coolpix s9400 advanced point &amp; shoot camera is selling cheaper at inr 14900 today,
803,0,sent!,
804,1,rt just uninstalled flipkart app  change ur policy..otherwise we will flush u out like anything..,
805,0,rt focused on but no timeline to go,
806,0,luckily have recorded all the calls to catch your and,
807,0,minimum 50% off on pressure cookers &amp; pans - flipkart,
808,1,ray ban aviator sunglasses is selling cheaper at inr 5990 today,
809,-3,"ships faulty product, replace with faulty product &amp; then want you to purchase a new phone to solve their problem",
810,1,eos 1200d kit (ef s18-55 is ii) dslr camera is selling cheaper at inr 22800 today,
811,0,rvgrocks rt focused on but no timeline to go flipkart …,
812,0,it is,
813,1,it's available vikramjit. check,
814,2,it is available right now. get at,
815,3,it is available with another flipkart advantage seller completely safe to buy!,
816,3,hey a happy soul  aham_bhram_asmi wanna get free iphone 6? kindly check my bi0. thx,
817,1,alpha a77vm (body with 18-135 mm lens) dslr camera is selling cheaper at inr 86890 today,
818,0,"my order deliverd at different address than mentioned.
i ordered 3 quantity, on packet its written as 3 bt received only one.",
819,1,"unfortunately, their response is too cool &amp; efforts are not seen to rectify mistakes immediately",
820,-1,"cant you resolve customers issue immediately?
why it takes 10 min to connect call  &amp; need to wait 1 day fr problm solution",
821,0,lets see (kisme kitna he dun....) am also in.....,
822,0,rt below rs.20000,
823,0,flipkart's making shopping happening with this chat app,
824,0,"buy pop 8s  rs.10,499 from flipkart

buy",
825,0,2.1 multimedia speaker system explode is selling cheaper at inr 2498 today,
826,0,bought a motox 32gb from flipkart which was downgraded to 16gb while under repairs with motorola. no answers yet in 6 months.,
827,0,one flipkart .... i am in....this contest....,
828,0,"flipkart exclusive  alcatel pop 8s tablet (black, 8 gb,  rs 10499",
829,2,\why top executives are leaving startups like,
830,2,"interesting. why top executives are leaving startups like flipkart, snapdeal, ola &amp; others - the economic times",
831,0,vikeshdhyani flipkart's making shopping happening with this chat app …,
832,0,uber cab voucher for your flipkart voucher?,
833,0,giant  betting on,
834,0,buy xxxl bean bag covers for just rs 699 in flipkart,
835,1,giant flips the kart of  wins court battle,
836,-1,it's logistics guys from who are repeatedly committing the same offence for prepaid orders from,
837,0,"giant flipkart betting on visenze forrester
…",
838,0,"alcatel pop 8s tablet with voice calling (8 gb, for rs.10499 freebies  flipkart",
839,0,"flipkart women's kurta sale 60 % discount. 

offer page",
840,0,tag dzire wired mouse just for rs.119 only  flipkart (limited period offer),
841,0,"lee, levis, wrangler, pepe &amp; minimum 50% off on men's casual wear  flipkart",
842,0,"moto g 3rd gen comes with flipkart app preinstalled, and can't be removed.",
843,0,hitech microsdhc 16 gb class 10 premium for rs.379 only  flipkart (limited period offer),
844,0,flipkart rethinking its app-only strategy,
845,0,"hello flipkart! amazon expands 'prime now' service, offers alcohol delivery for first time",
846,1,sandisk cruzer blade 8 gb pendrive is selling cheaper at inr 218 today,
847,0,"rt flipkart, snapdeal, amazon, others dole out incentives to sellers",
848,0,flipkart adds social layer to its mobile app with ping | ndtv gadgets,
849,0,"forget flipkart, snapdeal &amp; amazon. 

goibibo, oyo rooms &amp; zo rooms r changing d way indians stayed at hotels.

jai ho venture capitalist",
850,2,assassin's unity is selling cheaper by 4% at inr 890 today,
851,0,i have a amazon voucher.. i want to exchange it for voucher.. please help team,
852,0,flipkart has launched its new online shopping in-app feature. stay tuned for more online updates.,
853,1,amazon or flipkart... as they are popular here in india,
854,1,"launching alcatel pop 8s tablet priced  rs 10,499 in flipkart . get 500rs flipkart gift voucher free with this",
855,1,guys join &amp; win 2 smartphone,
856,0,rt flipkart has launched its new online shopping in-app feature. stay tuned for more online updates.,
857,2,when motog3 16gb addition will available (currently out of stock).... eagerly waiting for it.,
858,1,i3 3220 is selling cheaper at inr 7150 today,
859,0,flipkart keeps app plan on hold to assess how it will impact sales in big-ticket categories | et...,
860,1,"this \patel summelan\\ crowd in ahmedabad looks like a vc funded party at flipkart - lots of noise""",
861,1,read to win smartphone?,
862,1,"rt this \patel summelan\\ crowd in ahmedabad looks like a vc funded party at flipkart - lots of noise""",
863,0,rt ama  this 5th of sep at 3pm,
864,1,rt  read to win smartphone?,
865,0,ya i am in,
866,1,i want to win a smartphone.......,
867,-2,please raise a return request from your flipkart account for further assistance. sorry for the inconvenience though.,
868,0,"baught redmi2prime frm on 14th aug15. mfg date sept2015,fooling ppl its made in india.manuals in chinese.",
869,1,flipkart android app is now available at repository.,
870,0,rt   this happens when u buy product on  plz sell product on,
871,-1,rt  how the hell? how can you cancel an order after being shipped!!!! and for a silly reason.,
872,2,"rt  , kudos to you guys for moving at such a fast pace to become used or refurbished products are the on…",
873,1,"rt  use for all complaint's, i'm fighting for right against flipkart!",
874,0,rt  is  is,
875,0,"rt how  sell things
.
.
.
.
err, i mean ethics",
876,0,rt   u have not refunded my money back for the damaged good. its now a or a…,
877,2,congratulations for the the ping app sir. i had similar plans. sir would love to be an intern at flipkart and make a difference.,
878,1,"check this out on flipkart!
the next and the best smartphone by samsung",
879,-1,rt fucking sent my order after just one delivery attempt that too on a had to reorder &amp; wait fr another 3 da…,
880,0,i will cancel my order nd place it on desi,
881,0,*author news* smashwords and flipkart to end distribution relationship,
882,-1,hey   how do sell a honor6 wth defected screen &amp; refuse to replace it! od203620748677700500 is the order fyi,
883,1,is our with me or everyone.. no single image is loading on flipkart app. on a decent 3g network.!!,
884,0,and guess what no return option on cc number.,
885,0,"nikon withdraws caution notice against flipkart, snapdeal - livemint",
886,0,"nikon withdraws caution notice against flipkart, snapdeal",
887,2,"that's another successful k3 note sale. all thanks to you guys. also, get ready for the open sale on sept 2",
888,2,"rt that's another successful k3 note sale. all thanks to you guys. also, get ready for the open sale on sept 2",
889,0,rt *author news* smashwords and flipkart to end distribution relationship,
890,0,leaving customers hanging has become your habit! not responding to calls &amp; asking to do unecessary software reset,
891,2,rt our book is available on and hope you like it.,
892,0,when the screen is clearly defected! what are you trying? to fool me? seriously?,
893,0,"what r u checking i hv dropped pic of d product received, delivery boy hving in hand",
894,3,rt  i love my sister  cute smile when i gift her flipkart voucher to shop at her will. that's amaz…,
895,0,"rt nikon withdraws caution notice against flipkart, snapdeal",
896,0,sending u again,
897,1,"don't fight guys, you both are responsible for capturing smiles across",
898,0,smashwords &amp; flipkart to end distribution relationship – kdp info–must read,
899,0,it is recent one. what is the status of my 3 month old issue.,
900,1,community has enough money to participate in flipkart's next round of funding,
901,-1,just tweet we are worse than baggers i will leave my money,
902,1,tweet we are raised to be like this i will give u more money,
903,0,ys making sense of flipkart’s and snapdeal’s valuations through their gmv via,
904,0,just tweet this practice is hereditary i will ask 2-3 people to donate u,
905,1,anyone who want to work for then check out -,
906,1,"i want to exchange my flipkart voucher worth with amazon voucher 
 rt please",
907,0,great.. !! !!!,
908,1,please write to amar[at]flipkart[dot]com there is always a possibility with us if interests match.,
909,1,flipkart home security cameras upto 70% off home security cameras best price,
910,-1,how to remove or disable the feature from your app on my phone?,
911,0,"hey shopper,check out this latest flipkart — gift vouchers rs. 250 cashback...",
912,0,thr wud b open sale of on  ? no reg nothing.. straightaway logon to website n buy?,
913,0,yessir that's right!,
914,1,"hey shopper,check out this latest flipkart — gift vouchers rs. 250 cashback on rs. 4000 …",
915,0,amkette wired s6 for rs.595 | s8 for rs.879 only  flipkart (limited period deal),
916,0,"adobe and flipkart executives present used cars platform 

user cars seekers can find a reliabl...",
917,0,surprise prize! preorder 'all aboard' from  answer one question. click,
918,0,finally got the ping invites. can't wait to try,
919,1,"i want to beat online shopping portals giants like amazon and flipkart , want to buy anything they have",
920,1,"upload you restaurant bills on this app and get free bookmyshow, flipkart &amp; amazon vouchers.",
921,0,"court asks  to remove  &amp;  ..online retailer's names, from their caution notices (warranties will be honored)",
922,1,"upload you restaurant bills on this app and get free bookmyshow, flipkart &amp; amazon vouchers.
…",
923,0,withdraws caution notice against  &amp;,
924,1,"...lot of false promises for last 3 days, pl update...",
925,1,"we don't mean to sound rude, but the fact is that the flipkart notifications doesn't work most of the time.",
926,0,rt  withdraws caution notice against  &amp;,
927,0,",dis is regarding ur latest ofr of xtra 5% off while payng by visa debit card.bt dis didnt happened with me..od003737238930525500",
928,0,"rt court asks  to remove  &amp;  ..online retailer's names, from their caution notices (warranties …",
929,1,aviator sunglasses is selling cheaper at inr 1996 today,
930,0,for my last it is 3 months and still going on. so how much time for this issue.,
931,1,interesting read! ys research making sense of flipkart’s and snapdeal’s valuations through their gmv via,
932,0,"executives join hands to float platform for used cars, spinny",
933,-1,how fool u think customers are. i have posted screenshots of everything,
934,2,top executives are leaving startups like flipkart. are they hungry to start their own ventures?,
935,0,and u r dropping a mail that u r nt able 2 find my order to check,
936,0,rt surprise prize! preorder 'all aboard' from  answer one question. click,
937,0,"you need to put a price on your content, flipkart must give u shares for promoting them ;)",
938,2,"boost for etailers like flipkart, amazon as drugs act to be tweaked to allow online sales -",
939,1,"rt 
all ur get u cashback that can be redeemed  flipkart, jabong check &amp;",
940,0,same product but price differ,
941,-1,its surprising why flipkart keeps sending defective pieces to a person i follow. she keeps complaining. yet still orders from them.,
942,1,hd 203 wired headphones is selling cheaper by 3% at inr 2500 today,
943,0,flipkart offers zone via  offers zone,
944,1,70% off summer infant deluxe comfort baby bath seat price mrp,
945,1,grab now!! fresh stock manufactured in our europe unit is  set for both  &amp;  with expiring in 2017 from,
946,1,syma s107 &amp; s107g rc helicopter is selling cheaper by 6% at inr 1095 today,
947,0,rt smashwords and flipkart to end distribution relati...,
948,1,lumia 520 is selling cheaper at inr 5300 today,
949,0,"order id od303703756503260600
order recived. when u will send yatra code to my mail id.",
950,2,flipkart samsung galaxy j5(white black  gold 8 gb) at just rs.11999 - worthy phone -,
951,0,join,
952,1,"join 
and won big",
953,0,rt just launched the product...waitlist for ping invites up to 20k and growing by the minute!!,
954,0,congo,
955,0,rt inspired by apple's itunes s ping. now shop with your friends,
956,0,"rolls out ping, a social network with built in chat feature time to quit flipkart",
957,1,join  with its contest and win  vouchers,
958,0,flipkart adds social layer to its mobile app with the social shopping feature has been rolle...,
959,0,flipkart adds social layer to its mobile app with the social shopping feature has been rolled out in the...,
960,0,online retail company launches in-app chat feature called ping today - the economic times,
961,1,calvin klein one edt  -  200 ml is selling cheaper at inr 1431 today,
962,0,(oaumarket gadgets) flipkart adds social layer to its mobile app with ping rt plz,
963,0,already did!! will invite more,
964,0,no decision yet on,
965,0,at least change font before taking the screenshot,
966,0,hey! please send me an invite for flipkart ping!,
967,0,says no focus to go on only,
968,0,try,
969,-1,has chucked app-only plans? learnt the bitter truth from experience?,
970,0,rt making sense of flipkart’s and snapdeal’s valuations through their gmv,
971,1,join the  &amp; stand a chance to win 2  vouchers!,
972,0,- sony 5000 mah  -- flipkart -- rs. 658.0 -- mobiles &amp; mobile accessories,
973,0,"3 days and counting. \seller yet to confirm item\"" status for my order. what is happening?""",
974,1,"lover ? 
f&amp;d a111u multimedia speaker at 50% off rs 1349 paytm here …",
975,0,rt take the road less traveled and let your wish lead the way. there are no wrong turns. bon voyage!,
976,0,"rt  is epic. a new in d market
 we also belive always",
977,0,"hello punit, there is no flipkart app on blackberry 10 platform .....r there any plans",
978,0,"launched ping! a fun, social way to shop with friends on flipkart.
now go update your flipkart app!",
979,1,congrats winner wiish to twin next,
980,0,surprisingly there's no response ?!,
981,1,rt a fun way to to shop with friends.,
982,0,"flipkart announces ping, a social network that lets friends shop together

read more",
983,-2,rt amazon transport is ridiculously pathetic. unable to deliver my oneplus 2 even on expected date.,
984,0,hiring for vodafone and flipkart process job - gurgaon  delhi  noida. working days 6 days per week   min...,
985,1,flipkart is doing great,
986,0,"rt flipkart announces ping, a social network that lets friends shop together

read more",
987,0,flipkart puts decision to go app-only on hold,
988,0,please subscribe the flipkart first subscription,
989,2,"i like the ping option which is now available in  app. hope, isn’t inspired by apple ping.",
990,1,fonepad 7 me175cg dual sim tablet is selling cheaper by 2% at inr 9800 today,
991,1,launches - a chat application to discuss and shop with friends.  innovative ??,
992,1,onlyprathamesh join the godrejnupur &amp; stand a chance to win 2 flipkart voucher…,
993,0,"app gets ping feature, allows users to chat while shopping",
994,0,no decision yet on flipkart,
995,1,"another from the red-white-blue combination, available at 35% off on",
996,2,majesty duo 3 - piece cookware set is selling cheaper by 3% at inr 1401 today,
997,1,"redmi 2 prime can be a good buy, but is outta stock!! adding 1000 more bucks go for zenfone 2 laser",
998,0,another social website,
999,0,the challenge has ended. thank you for such an overwhelming response! pre-order here,
1000,1,good 1,
1001,0,inspired by apple's itunes s ping. now shop with your friends,
1002,0,"paritosh vyas, paritosh2608   -&gt; discover flipkart offers, coupon codes at",
1003,1,thanks a lot team for this awesome gift.,
1004,2,well e-retail is good but companies needs to diversify,
1005,2,"flipkart working to gain mastery over artificial sachin bansal, ceo - the economic times",
1006,0,flipkart hires google executive mayur datar as data scientist - the economic times,
1007,0,such big companies should tie up with education sector to source d human resource,
1008,0,online retail company flipkart launches in-app chat feature called ping today.,
1009,0,new india's largest online retail company flipkart on tuesday launched a new chat feature called ping...,
