,score,text,score_ideal
321,1,kaspersky internet security - multi-device is selling cheaper at inr 1399 today,1
322,0,wd 1 tb black desktop internal hard drive (wd1002faex) is selling cheaper at inr 6025 today,1
323,0,"rt the number game 
ys making sense of flipkart’s and snapdeal’s valuat…",0
324,1,unite 2 a106 (8 gb) is selling cheaper at inr 5830 today,1
325,0,any idea when   and  are launching in india?,0
326,0,making sense of the valuations done by these companies through their gmv. interesting!,1
327,1,rt  &amp;   on why top executives are leaving high growth startups,-1
328,0,"\shrinking interactions with the founders coupled with decreased influence on impactful decisions\\""
1447""",-1
329,2,"why top executives are leaving startups like flipkart, snapdeal, ola &amp;amp;amp; others",-1
330,1,looking for designer build a website for online store by want to create website like flipkart. (budget…,1
331,2,"why top executives are leaving startups like flipkart, snapdeal, ola &amp;amp; others | et retail",-1
332,0,"rt forget 
baap of all sale - visit",1
333,0,"samsung and in stock on flipkart
price rs 11,999 - 14,999",0
334,0,"yourstoryco rt the number game 
ys making sense of flipkart’s and sna…",0
335,0,how flipkart’s ping aims to redefine e-commerce through the messenger,1
336,0,thisisecommerce how flipkart’s ping aims to redefine e-commerce through the messenger …,1
337,2,"why top are leaving like flipkart, snapdeal, ola &amp; others",-1
338,2,"rt why top are leaving like flipkart, snapdeal, ola &amp; others",0
339,0,"&lt;-discover reviews and compare prices from flipkart,amazon and snapdeal",0
340,1,is it trusty  one,1
341,1,"rt just a little finishing touches needed, but the k3 note is almost ready for today's sale on  are you?",0
342,0,"indrani mukherjea &lt;-discover reviews and compare prices from flipkart,amazon and snapdeal",0
343,0,"surat &lt;-discover reviews and compare prices from flipkart,amazon and snapdeal",
344,2,"hii, 
we find you you the best deal out of the many online sites like flipkart, snapdeal, amazon, jabong etc",1
345,2,"why top are leaving like flipkart, snapdeal, ola &amp; others …",-1
346,0,"ok is it cash back site?? what are the offers for amazon,flipkart??",0
347,4,"you have a great product, how do you improve on it??  has done just that. great update, app is even better now. looks useful.",1
348,0,"brahmin &lt;-discover reviews and compare prices from flipkart,amazon and snapdeal",0
349,1,desire 816g (octa core) is selling cheaper at inr 15400 today,1
350,0,"rt &lt;-discover reviews and compare prices from flipkart,amazon and snapdeal",0
351,1,optimus g (e975) is selling cheaper at inr 18490 today,1
352,0,already?,0
353,1,flipkart buy gift vocher worth rs4000 &amp; get gift vocher of rs250,1
354,0,here's why flipkart has put its app-only plans on hold via,-1
355,2,"rt why top executives are leaving startups like flipkart, snapdeal, ola",-1
356,2,"why top executives are leaving startups like flipkart, snapdeal, ola &amp; others",-1
357,1,"hi flipkart. i've got sony bravia on monday, they said itll be installed on wed.still i didnt get any call. kindly help.",-1
358,0,flat 50% off on home sofas- big sale at flipkart !,1
359,1,is not everyone's cup of tea - why top executives are leaving startups,-1
360,0,online shopping goes social with flipkart's ping,1
361,0,"hey, check out ping! - let’s shop together on ping by flipkart.",0
362,1,"bean bag covers flat rs 499 flipkart
.
buy .
flipkart is offering amazing offers on...",1
363,1,on best selling titles minimum 45% off,1
364,2,support system being created by companies like    at workplace is much desired,1
365,0,usb cables minimum 24% off,1
366,0,"i'll opt for the lenovo k3 note coz even though the price is the same,  delivers to shillong while  does not!",0
367,0,footwear for men &amp; women flat 40% off,1
368,0,rt the rocking  product team with the rocking fashion bloggers!,1
369,0,how flipkart's ping aims to redefine e-commerce through the messenger,1
370,1,"sale-india's most affordable 4g smartphone lenovo a2010(black, 8 gb) -  rs. 4,990",1
371,-1,a wanna be monopoly when people stopped giving a fuck about long back,-1
372,0,"totes, backpacks &amp; more min. 40% off",1
373,1,f&amp;d w330x wireless speaker is selling cheaper at inr 3790 today,1
374,0,"rt    these guys r fraud, wl nt gv u return in 30days period. they only mentioned i…",-1
375,-1,on fiction best-sellers minimum 45% off,1
376,0,"\shrinking interactions with the founders coupled with decreased influence on impactful decisions\\""
2113""",-1
377,1,got appreciation for my idea from team for thinking ahead. happy not content,1
378,-1,when can i expct a call back. how difficult it is send sum1 to come n pikup the not working device.,-1
379,1,x-box 360 4 gb kinect holiday bundle is selling cheaper at inr 24500 today,1
380,1,thanking u beautiful,1
381,2,"why top executives are leaving startups like flipkart, snapdeal, ola &amp; others - economic times",-1
382,0,do try this out,0
383,0,thanking u bro,1
384,0,wah!! congrats...,1
385,0,"waitlist for flipkart ping already at over 100k, says punit according to soni, flipkart has 50 million p...",1
386,0,thanking you bro,1
387,-2,exclusive...replaced product shoddy finish...no qc once again why do they carry such a shoddy manufacturer,-1
388,0,"'sheena'   -&gt; discover flipkart offers, coupon codes at",0
389,2,rt we have our 1st winner for today!congratulations  enjoy your rs.5k  voucher! ht…,1
390,0,lenovo k3 note black and white variants to go on sale on flipkart today…,1
391,0,flipkart launches ping. now shop with your friends » nextbigwhat,1
392,-1,disappointed with service by flipkart jbl t200a,-1
393,0,"rt flipkart launches new feature 'ping'

 -via inshorts",1
394,0,rt shopping goes social with  ping. will this feature give it an edge over the others?,1
395,0,my  answer to how do i turn off notifications in the flipkart app?,0
396,0,flipkart ping – making online shopping go social again,1
397,1,flipkart 3 order successfully delivered within 2 day,1
398,1,"glocal source apple stainless steel  525 mug

ads on 99spr",0
399,0,flipkart launches in-app chat feature called ping,1
400,0,"rt 8gb) just rs. 11,999 with 4 more offers –",1
401,0,"rt 32gb, white) just rs. 7,349 on exchange offer –",
402,0,"rt digiflip pro et701 tablet( 8gb, wi-fi) just rs. 3,499 on | go shopping mart",
403,0,flat 50% off,
404,0,"unicorn developers who think survive because of them, may soon realise reality is exactly the opposite",
405,1,"shopping goes social with flipkart ping, dbs bank to soft launch its mobile banking pla...",
406,3,today's 2nd winner is...  congratulations enjoy your rs.5k  voucher!,
407,3,rt today's 2nd winner is...  congratulations enjoy your rs.5k  voucher!,
408,1,congrats deserving,
409,1,wow congrats guy ;-),
410,0,"digiflip pro et701 tablet at rs.3,499  upto 16% from &gt;&gt;",
411,0,ratb-11032cy resistance tube is selling cheaper at inr 1050 today,
412,0,congrats,
413,0,"hii devender singh devendersingh93, want to get iph0ne 6 for free? please go check my bi0. thx",
414,0,"hii storyofpen2013 storyofpen2013, want to get iph0ne 6 for free? please go check my bi0. thx",
415,1,congratulations winners! inbox us your email ids with your id proofs to receive your flipkart vouchers from us.,
416,0,when can we expect the accessories for  canvas xpress 2 in india?,
417,1,sdhc 32 gb 40 class 10 is selling cheaper at inr 935 today,
418,1,xperia m is selling cheaper at inr 1490 today,
419,0,rt latest mobiles phone with price via,
420,0,"starting at rs.42,990",
421,0,congratulations....,
422,0,"hc suggests nikon to withdraw flipkart, snapdeal from caution notice",
423,0,dtn flipkart vs truce lesson for online the conversation around e-commerce marketplaces an...,
424,0,"of an invincible man who refused to give up, \god walks my dreams\\""
2284""",
425,0,rt just found this video of the making of this photoshoot for flipkart...can u tell i had barely slept the night …,
426,1,rt congratulations winners! inbox us your email ids with your id proofs to receive your flipkart vouchers from us.,
427,0,"pro et701 tablet at 41% off buy for rs 3499 on  here 
go",
428,1,es3528 riley analog watch  - for women is selling cheaper at inr 9595 today,
429,0,latest from flipkart adds ping chat feature to its mobile suite,
430,1,"why top executives are leaving startups 

most to start up on their own. enuf space for all to grow n create value.",
431,2,newborn to toddler portable rocker is selling cheaper by 7% at inr 4199 today,
432,1,tomorrow's episode of  is going to be awesome and it's titled \flipkart pings it,
433,0,"how u cancel my order if your seller first delivered the item on the address now he cant 
od103715045879753700",
434,1,"yayayayaya finally thankyou soooo   much team, you're the best...  wshing you gr8 success for",
435,1,rt    congrats deserving,
436,0,finally got rid of in reboot loop.,
437,1,rt  wow congrats guy ;-),
438,0,rt   congrats,
439,0,"rt    

congratulations....",
440,0,ty so much,
441,0,thanks,
442,0,haha thankyou,
443,0,"can you beat this, i just praised and here is one more signs of dumbness",
444,0,pray for me ;p,
445,2,thank you so much team love you....big  thanks  for making my day,
446,-1,court adjourns hearing on plea against nikon's advisory notice,
447,0,rt    pray for me ;p,
448,-1,your team is asking for registered email id after so much chaos again. exhausting,
449,1,"you played really well, m sure you'll win too...",
450,1,"rt    you played really well, m sure you'll win too...",
451,0,rt    haha thankyou,
452,0,"hope,believe,faith",
453,-1,i invited all my friends played hard till the end wish to win plz disappoint me team,
454,0,rt how ping aims to redefine through the,
455,0,grea alexander retailers flipkart –,
456,0,congrats again,
457,1,after numerous mails i am still not able to get my edge royality redeemed flipkart coupon. kindly help,
458,-1,"congrats.
desperately wanna be the next one",
459,1,congratulations girl!,
460,0,do you have an invite for flipkart’s ping? please send me one.gy,
461,-1,plz don't disappoint me team,
462,0,not sure why my order  od303743684285138100 is being canceled ?,
463,3,thank you    best of luck,
464,1,plz check my entries invited all my friend played till the end wish to win,
465,2,top executives are leaving startups like flipkart and ola. are they hungry to start their own ventures?,
466,1,congratulation,
467,0,a few days ago  was running a sale on - they were retailing for under 3k.,
468,0,ping  &amp; ping  for announcing the new shopping experience via waiting for an invite now..,
469,0,only 4 winners left don't break my heart plz,
470,0,_kumarprashanth rt how ping aims to redefine throu…,
471,0,niteshbhalothia rt how ping aims to redefine throu…,
472,0,i believe you will make my day tomorrow,
473,1,hoping to be 7th winner,
474,0,"hey, check out ping! - let’s shop together on ping by flipkart. here’s an invite",
475,-1,"macha to disprove it i can state flipkart, oola and many more....we started late  &amp; soon v will take global space in products !!",
476,0,avaiable now  flipkart,
477,0,smashwords and flipkart to end distribution relati...,
478,0,flipkart launches ping for collaborative shopping experience,
479,0,the cutest bookmark from flipkart. a cutout comb for those that are too…,
480,0,"'atmospeher' &amp; 'ushered'   -&gt; discover flipkart offers, coupon codes at",
481,1,hey   looks like some spam stuff,
482,1,"shopping goes social with flipkart ping, dbs bank to soft launch its mobile banking platform in…",
483,1,rt hey   looks like some spam stuff,
484,3,rt we have winner congratulations  - we hope you enjoy your rs.5k  voucher! ht…,
485,2,rt   here's my happy winning,
486,0,"deals of the day – august 26, 2015",
487,1,"shopping goes social with flipkart ping, dbs bank to soft launch its mobile banking…",
488,0,min 50% off,
489,2,rt a bowl of is inspiration enough! to win flipkart vouchers.,
490,0,"i want to exchange my 500 rs bms voucher with flipkart or amazon voucher... 

pls help me",
491,0,"make a price comparison site and retrieve information directly from amazon, flipkart and snapdeal -- 3 by v3king",
492,2,good news!!!!!!! mountain peak books will be soon available on flipkart.,
493,1,rt tomorrow's episode of  is going to be awesome and it's titled \flipkart pings it,
494,1,how come the 16gb moto phone both colors out of stock for the last days ?  when do guys plan to have it available ?,
495,0,91% off newtronics back cover for htc desire 816 800 d816w (transparent black) price mrp,
496,0,is doing window shopping on flipkart,
497,0,cant find redmi 2 prime mobile. plz collect this phone.any chance to get?,
498,1,rt and on  you get a chance to win a monisha jaising luxe wrap when you order http…,
499,0,this one?,
500,0,rt this one?,
501,1,"once upon a time  used to deliver books in a cardboard box and cute bookmarks.now, no bookmarks &amp; old bubble wrap.bookstore missing",
502,1,"shopping goes social with flipkart ping, dbs bank to soft launch its mobile banking platform in india",
503,1,"i hope you guys are not planning \only mobile\\ like flipkart.\""""",
504,0,participate here,
505,0,0,
506,0,"after myntra, flipkart to dabble in social shopping! ping announced!",
507,0,od003736137582405000 is supposed to be delivered on 27th..not yet shipped! i am watching closely,
508,2,hey  nice way to upload my contacts to your servers. well played!,
509,1,"rt    

participate here 

\dhvani bhanushali\\ contest and win flipkart 5k voucher""",
510,0,1,
511,0,"flipkart today announced ping, a new feature in its mobile app which will allows users to chat with their friends while shopping.",
512,1,wah!! congratulation,
513,0,do you know abt this one?,
514,0,"\shrinking interactions with the founders coupled with decreased influence on impactful decisions\\""
2967""",
515,0,"of an invincible man who refused to give up, \god walks my dreams\\""
3138""",
516,2,"join guys  take part in \dhvani bhanushali\\ &amp; get lucky flipkart vouchers worth rs.5000 to be won.""",
517,0,get pradeep an invite!,
518,1,rt the link to order on  right,
519,2,"join guys hifidigi take part in \dhvani bhanushali\\ &amp; get lucky flipkart vouchers worth rs.5000 to be won.""",
520,-1,your flipkart guys are cheating,
521,1,"rt  tell us about the song &amp; win flipkart egv! tweet us using our tag \ dhvani bhanushali \\. go go go!""",
522,2,"join  &amp; play \dhvani bhanushali\\ &amp; get lucky flipkart vouchers worth rs.5000 to be won.""",
523,0,participate here guys,
524,0,want to shop online with your friends? has a solution. -,
525,2,"rt join guys  take part in \dhvani bhanushali\\ &amp; get lucky flipkart vouchers worth rs.5000 to be won.""",
526,0,3rd gen,
527,-1,you flipkart guys cheated me i 'll prove ....what you are doing mr . ceo sachin,
528,-1,dont you feel bad,
529,1,microsd card 16 gb 30 class 10 is selling cheaper at inr 401 today,
530,0,"rt shop\ping\\ redefined by""",
531,0,2,
532,1,btw had an interesting conversation with flipkart rep yesterday regarding ads. ads are only shown on android app as of now.,
533,2,top executives are leaving startups like flipkart. are they hungry to start their own ventures?,
534,-1,flipkart ...y asking for trouble by joining hands with indian post.,
535,0,"if our tag \ dhvani bhanushali \\ starts trending in india we will increase the total amount of flipkart egv's too! rt\""""",
536,0,"rt if our tag \ dhvani bhanushali \\ starts trending in india we will increase the total amount of flipkart egv's too! rt\""""",
537,0,flipkart launches a new feature called 'ping' -  -,
538,1,"- prestige mini induction cooktop pic 1.0 rs. 1299, men’s clothing minimum 50% off – flipkart",
539,0,flipkart ping lets you go on an online shopping spree with your flipkart has… sps®,
540,0,lets rock,
541,2,"rt why top executives are leaving startups like flipkart, snapdeal, ola &amp; others - economic times\",
542,0,"ping by  from social shopping to bargaining,bill split,group buying. endless possibilities",
543,1,order 203718422057485600 puma running shoe not yet delivered. got the refund but surprised with no updates,
544,-1,missed the k3 note sale on flipkart by 1 minute! — feeling down,
545,0,rt lets rock,
546,1,od003728820444273200 i received my moto g3 today but the promised airtel sim card was missing from the package. what do i do now?,
547,0,please get in touch with  in this regard.,
548,0,today's contest is live on our fb page. hop on now! egvs are up for grabs. rt,
549,-2,"no they don't cheat,but their process is lame and some dumb irresponsible people in support center",
550,0,rt today's contest is live on our fb page. hop on now! egvs are up for grabs. …,
551,-1,"hi,i hv placed some wrong product if i cancel my order thn i'll get my gift card money back or not??",
552,0,"are making online shopping more social, launching more here -",
553,1,"savemoneyindia prestige mini induction cooktop pic 1.0 rs. 1299, men’s clothing minimum 50% off – flipkart",
554,1,"prestige mini induction cooktop pic 1.0 rs. 1299, men's clothing minimum 50% off - flipkart",
555,-1,more cheap service than telecom company i.e.    cc,
556,0,get extra 5% off on 2-in-1 laptops on purchase through debit cards,
557,1,wud luv to see this in india as well   amazon uk will waive delivery fees if you pick your order up,
558,1,"boy! is she mad 
not fair flipkart,not fair",
559,0,- i have a flush  - full house baby(5bn);  -ye lo royal flush..ping!,
560,1,"with $15 billion valuation and 330 employees, snapchat tops the list with highest valuation per headcount $48 million.flipkart about1 mil!!",
561,1,android one is selling cheaper at inr 5182 today,
562,0,expansion 3 tb external hard disk is selling cheaper by 4% at inr 7999 today,
563,0,when is the next open sale for k3 note in flipkart?,
564,2,give your pet best of what they deserve buy pet supplies on flipkart and get great discounts and deals on them,
565,1,"dhvani bhanushali is now trending in india! let's take it higher folks! 

keep tweeting &amp; win flipkart egv's! rt",
566,0,wedge mobile bluetooth standard keyboard is selling cheaper by 2% at inr 4190 today,
567,1,"rt dhvani bhanushali is now trending in india! let's take it higher folks! 

keep tweeting &amp; win flipkart egv's! rt",
568,-1,pl send screen grab of the error message will take it up with,
569,0,flipkart ping lets you go on an online shopping spree with your flipkart ping lets you go on an onlin...,
570,1,canvas knight cameo a290 is selling cheaper at inr 7095 today,
571,0,to remove the names of  &amp;  from website advisory.,
572,2,congratulations  on winning the contest. inbox us with your email id to claim your flipkart voucher,
573,0,rt  to remove the names of  &amp;  from website advisory.,
574,2,rt congratulations  on winning the contest. inbox us with your email id to claim your flipkart voucher,
575,1,what about 10 weekly winners for flipkart vouchers .........,
576,-1,&amp;  let d process of buying b simple dont make it complicated by having registrations,
577,0,haa yar.just a product feature web pe daal dete press release. khane ko bhi nhi mila dhang se,
578,0,50% off jbl t26c wired headphones price mrp,
579,0,"'jagatraj', 'tirpathi', 'payno' &amp; 'bora'   -&gt; discover flipkart offers, coupon codes at",
580,0,"'dismisses'   -&gt; discover flipkart offers, coupon codes at",
581,2,top executives are leaving startups like flipkart and ola. are they hungry to start their own senio...,
582,0,please check screenshot,
583,0,to withdraw suit against them following their submission.,
584,0,"aims to redefine e-commerce through the messenger, 40% online shopping in india happens through...",
585,0,flipkart likely to shut down website in september to follow app-only model,
586,2,"why top executives are leaving startups like flipkart. are they hungry to start their own ventures?
post link",
587,0,is looking into it.will check with  &amp; get back on what's the issue.,
588,2,"rt why top executives are leaving startups like flipkart, snapdeal, ola &amp; others",
589,2,flipkart's is amazing service. just needs to be incorporated in the way it should. right now need an invite soon.,
590,2,why top executives are leaving firms like    &amp; others,
591,0,rt   is looking into it.will check with  &amp; get back on what's the issue.,
592,1,nexus 5 is selling cheaper by 3% at inr 26999 today,
593,0,flipkart rakhi offer get rs 250 e-gift voucher on purchase of rs 4000,
594,0,flipkart’s ping redefine e-commerce and enables social shopping through the,
595,0,91% off newtronics black back cover for htc desire price mrp,
596,1,nvidia gtx660 ti-dc2t-2gd5 2 gb gddr5 graphics card is selling cheaper at inr 24400 today,
597,0,- 76% off on star xxxl teardrop bean bag cover at flipkart,
598,1,a6000 plus is selling cheaper at inr 7000 today,
599,1,rt alibaba says its new artificial intelligence platform is china’s first  is building,
600,1,share store online - buy share products online at best price in india |,
601,0,congratsss,
602,0,congratssss,
603,0,large e-com firms will follow,
604,1,"won book for me
his email 
my phone no.- 8978741628",
605,1,"flipkart gift vouchers rs. 250 cashback on rs. 4000

rs.3750.00",
606,1,eagle kichen pro roti maker is selling cheaper by 2% at inr 480 today,
607,0,swipe ultimate tablet is selling cheaper at inr 13990 today,
608,0,my  answer to how many days does it take to receive an order from chennai to allahabad through flipkart?,
609,0,flipkart introduces ping to enable social shopping,
610,0,"alcatel pop 8s tablet  rs 10,499 at flipkart – 3 launch offers",
611,1,aarushi (english) is selling cheaper at inr 189 today,
612,1,"just got off flipkart app, they must learn from jabong &amp; amazon! which counts as your fave app?",
613,2,"why top executives are leaving startups like flipkart, snapdeal, ola &amp; others?",
614,0,"amazon, crosswords, the vuca company in flipkart",
615,2,day by day flipkart is providing awesome sevices as well as offers,
616,1,xperia z ultra is selling cheaper at inr 13398 today,
617,0,fyi this is what an original controller looks like. it ships with a disc and not a printout.,
618,1,rt order all aboard from flipkart and you could win a monisha jaising luxe wrap. details,
619,0,shop,
620,2,flipkart day by day flipkart is providing awesome sevices as well as offers,
621,1,tp-link td-w8961nd 300mbps adsl2 wireless with modemrouter is selling cheaper at inr 1575 today,
622,1,usb 2.0 keyboard is selling cheaper at inr 2890 today,
623,1,flipkart gift vouchers rs. 250 cashback on rs. 4000,
624,0,"i guess he wud speak about delivery speed of flipkart 
bcz it is hillarious in itself.",
625,0,wanted to order your book. can't find it on flipkart,
626,1,sandisk sdhc 32 gb 48 class 10 ultra is selling cheaper at inr 796 today,
627,1,this wonderful tote bag from  wud be an apt gift for her to carry things.,
628,0,rt get hold of the octa-core processor loaded in today's flash sale,
629,0,rt mrs funnybones arrived today via  i was secretly hoping for a personalised copy alas!!!,
630,0,"\shrinking interactions with the founders coupled with decreased influence on impactful decisions\\""
4067""",
631,0,"of an invincible man who refused to give up, \god walks my dreams\\""
4238""",
632,0,rt take part in the contest and take home 2 flipkart exclusive smartphones. going live 12 noon tomorrow!,
633,0,sure!,
634,0,excited.. m in...,
635,0,photo frames starting at rs.699,
636,0,check this out on flipkart!,
637,0,"102cm (40) full hd tv just rs.23,990",
638,0,lets play.....,
639,0,rt    congrats again,
640,1,rt    congratulations girl!,
641,0,rt    congrats,
642,0,claims none of the web firms in the world were building apps with deep linking technology as its,
643,2,satya paul women party brown genuine leather  clutch is selling cheaper by 15% at inr 549 today,
644,0,when is the result of contest?,
645,0,"rt    
congrats",
646,0,rt    congratssss,
647,0,rt rt shopping goes social with flipkart ping,
648,0,floral door curtains minimum 50% off,
649,0,"t-shirts, shirts &amp; more min 50% off",
650,0,rt check this out on flipkart!,
651,0,"rt 
before  flipkart 
after  bullock cart",
652,0,resorts to ‘ping’ to redefine through a messenger!,
653,0,floral window curtains minimum 50% off,
654,0,i'm .,
655,0,flipkart ping wants to make mobile shopping a more social experience,
656,0,got the flipkart ping invite. you can create groups too.,
657,0,wtf?! that has to be a typo - dear  please check! o_o,
658,0,that's great! really looking forward to it!,
659,0,- flat 50% off on home sofas -- flipkart -- rs. 14950.0 -- home décor &amp; furnishing,
660,0,"etretail | waitlist for flipkart ping already at over 100k, says punit soni",
661,1,xperia c3 is selling cheaper at inr 15794 today,
662,0,my  answer to what are the hidden charges for selling on snapdeal and flipkart?,
663,0,you got a chance to use it? i thought it wasn't live yet,
664,0,last few hours! get 5% instant on all orders at with debit cards -,
665,-1,"oh wait, it is a typo - look at the price offered by the other seller - inr phew!  had me worried for a moment!",
666,0,i'll wake up early tomorrow  . so that i can play contest !!!,
667,1,groovy a5 in-the-ear wireless headset is selling cheaper at inr 1825 today,
668,0,buy home security cameras upto 70% off at starting price rs 539 via flipkart,
669,0,i sent you an invite. check it out,
670,-1,rt the ping waitlist is now over a 100k!! working hard to send out more invites... let's keep going!,
671,0,and executives present used cars platform,
672,0,rt i ordered it from  and see from where they got it.,
673,2,my  answer to why isn't snapdeal's current evaluation promising enough compared to flipkart?,
674,1,best 25 online shopping website in india,
675,1,i'm in the contest! get ready with ur smartphone.. i recently got,
676,1,excited,
