,score,text,score_ideal
1,0,"flipkart app gets ping feature, allows users to chat while shopping",1
2,1,rt introducing the contest! participate &amp; win rs.2500 flipkart vouchers!,1
3,0,focussed on mobility but no timeline to go flipkart - -,-1
4,0,"rt flipkart rolls out ping, a social network with built in chat feature",1
5,0,let’s shop together on ping by flipkart. here’s an invite,1
6,0,rt finding your favourite fashion products was never so easy! try out the new flipkart app!,1
7,0,rt this is the team that made  ping possible. they pulled off something not many didn't even dare to think.,1
8,0,flipkart 25th august deal of the day ... -,0
9,0,competing with flash sale as against  falsh sale of,0
10,0,&lt;a apple iphone 6 from,0
11,0,"flipkart rolls out ping, a social network with built in chat feature",1
12,1,"flipkart and adobe executives join hands with an angel to float platform for used cars, spinny",1
13,0,&lt;a apple iphone 6 plus from,0
14,0,ceos of two start-ups acquired by flipkart resign,-1
15,1,"lover ? 
f&amp;d a111u multimedia speaker at 50% off rs 1349  here 
rs 2079 
rs 2078",1
16,0,flipkart adds social layer to its mobile app with ping,1
17,1,"rt \india is leading the mobile revolution in the world &amp; mobile is no more just a choice\"" -""",1
18,1,participate and win flipkart vouchers come  join now,1
19,0,i m waiting for my copy.. as flipkart say its out for delivery..,-1
20,1,"rt  
thanks a lot team for this awesome gift.",1
21,0,rt consumers can choose contacts they want to share their chosen products with and have real time conversation with them,0
22,0,rt flipkart adds social layer to its mobile app with ping,1
23,0,"got the replacement &amp; its the same issue. not working after 5.1 upgrade. i'm done, seeking",-1
24,0,making sense of flipkart’s and snapdeal’s valuations through their gmv,0
25,0,earn  and  vouchers for answering surveys on join at,1
26,1,rt for this pic to win vouchers from flipkart!,1
27,1,"sony xperia m4 aqua dual rs 20,300| 19,499| rs.19,089 &lt;--- best price",1
28,0,"rt launched ping! a fun, social way to shop with friends on flipkart.
now go update your flipkart app!",1
29,0,&gt;  new feature is invite only. has an option to ask friends for one. but doesn't tell me who has one. uh.,-1
30,0,- 51% off on bosch gsb 500 re kit power &amp; hand tool kit at flipkart,1
31,1,thank you. this link takes me to the flipkart first page on the app but doesn't allow me to renew it.,-1
32,2,"follow to win
 
&amp; stand a chance to win 2  vouchers!",1
33,0,invite your friends for the  vouchers to be won!,-1
34,0,hey! do you have an invite for ping by flipkart? please send me one!,0
35,1,rt  join the  &amp; stand a chance to win 2  vouc…,1
36,0,rt a move towards building social commerce.,1
37,1,is not as impressive as new office,-1
38,3,love it!! really nice and innovative it is ..,1
39,-1,rt that awkward moment when bse seems to offer more discounts on stocks than on,-1
40,0,invite your friends for the flipkart vouchers to be won!,1
41,2,"rt follow to win
 
&amp; stand a chance to win 2  vouchers!",1
42,3,rt unlocking  winner congratulations  enjoy your rs.5k voucher from,1
43,0,earn    and  vouchers for answering surveys on join at,1
44,1,"rt sony xperia m4 aqua dual rs 20,300| 19,499| rs.19,089 &lt;--- best price",1
45,0,rt the team that made a reality. here's to more social shopping days.,1
46,0,kids sports watches from rs.170 flipkart,0
47,1,rt  thank you very much,1
48,0,rt invite your friends for the  vouchers to be won!,1
49,0,no decision yet on flipkart -,-1
50,0,rt let's hear more from,0
51,0,flipkart adds social layer to its mobile app with ping - ndtv,1
52,0,do you have an invite for flipkart’s ping? please send me one.,0
53,1,rt  join the  &amp; stand a chance to win 2  voucher…,1
54,0,experimenting around social shopping..and hence a stand-alone app?,0
55,0,"(flipkart adds social layer to its mobile app with ping)

the social shopping feature has...",1
56,1,rt flipkart ping announced. a social network on top of the flipkart app. let's you share products with anyone and chat.,1
57,0,flipkart ping brings social networking into online shopping -...,1
58,0,flipkart adds social layer to its mobile app with ping,1
59,0,thanks a lot rohit!,1
60,0,and when are you declaring the flipkart voucher winners?,0
61,0,"rt in 4 yrs,",0
62,1,play  win  vouchers,1
63,1,"rt \india is leading the mobile revolution in the world &amp; mobile is no more just a choice\\ -""",1
64,1,toys jcb earth mover is selling cheaper by 2% at inr 84 today,1
65,0,"with ping, flipkart brings social networking to app",1
66,0,"flipkart blends social with shopping, launches ping for messaging",1
67,2,"rt snapdeal
amazon 
myntra 
flipkart 
yepme 

rupee 
promises 

everything is available on huge discounts.",0
68,0,hey! do you have an invite for ping by flipkart? please send me,0
69,0,"flipkart announces ping, a social network that lets friends shop together news, news - india today",1
70,0,buy camphoor lamp,0
71,2,rt ready for some fun? for the image &amp; you can win rs.2500 flipkart vouchers!,1
72,0,earn  and  vouchers for answering surveys   on join at,1
73,0,"with ping, flipkart brings social networking to new e-commerce major flipkart today said it is foc...",1
74,0,flipkart puts a hold on plans to go app-only » nextbigwhat,-1
75,0,"no decision yet on 'app-only', says flipkart.",-1
76,0,flipkart’s ravi vora steps down as ceo of strategic brands,-1
77,1,waiting for an invite to check how it works !!,0
78,0,"shreya ghoshal, shreyaghoshal   -&gt; discover flipkart offers, coupon codes at",0
79,0,"'gratitude', 'seatbelt', 'humbling' &amp; 'bangaluru'   -&gt; discover flipkart offers, coupon codes at",0
80,0,dear  do you expect me to verify my phone no. every 30 days?,-1
81,0,rt flipkart launches ping. now shop with your friends,1
82,0,"flipkart, snapdeal, amazon, others dole out incentives to sellers",1
83,-3,"rt flipkart loses rs 2.20 for a re earned, amazon loses rs1.90 and snapdeal rs 1.70.
total losses flipkart rs 5440cr,snapdeal 53…",-1
84,1,all flipkart promise not fullfilled and they still have my products and money as well.seller's stop working with them.,-1
85,0,whatsapp ... what else.... here comes the ping... lol... shop chat... rockzzz,0
86,-1,my new shoes &amp; bata sandals(same as the one which i lost in goa) ordered from flipkart &amp; got,0
87,-2,"how can you be so indifferent with those who are not your fkrt 1st customers.
this is pathetic behaviour.",-1
88,0,here comes   ping,0
89,0,... what else.... here comes the ping... lol... shop chat... rockzzz,0
90,0,earn  and         vouchers for answering surveys on join at,1
91,0,flipkart goes social; now chat with your friends when you shop.,1
92,1,at best price,1
93,0,online shopping goes social with flipkart’s ping – times of india,1
94,0,rt  is bridging gap between &amp; one step at a time by,1
95,1,mentoring the 'i' discipline (english) 1st edition (paperback) is selling cheaper at inr 164 today,1
96,0,"od303332734471861100
was out 4 few days n servant received the product on my behalf..",0
97,1,this is something interesting keep it on guys ...  is innovating,1
98,0,what does oder on hold means? when will my ordier with order id order  od303683387431286500 be delivered?,0
99,0,earn  and  vouchers        for answering surveys on join at,1
100,0,flipkart ping let’s users chat while they shop,1
101,1,rt  join the  &amp; stand a chance to win 2  vouchers!,1
102,1,rt with 4g for multi-player gaming. available on flipkart. http…,1
103,0,expect large e-commerce firms across globe to follow flipkart,1
104,1,guess which book i ordered from  right now?,0
105,-1,why dumped only policy?,0
106,0,earn  and  vouchers for        answering surveys on join at,1
107,0,rt wait list at 50k and climbing!!,1
108,0,"rt screengrab replacing links. leveraging contacts. social proof, we-know--you-better-coz-we…",0
109,0,online shopping goes social with flipkart,1
110,-1,back from dead inside the subhas bose mystery is selling cheaper at inr 295 today,1
111,0,rt 40k waitlist and going!!! ping is exploding on flipkart!,1
112,1,t400 wireless optical mouse mouse is selling cheaper at inr 899 today,1
113,1,creature iii speaker is selling cheaper at inr 2999 today,1
114,0,"flipkart launches 'ping', a brand new social collaborative shopping experience on its mobile app",1
115,1,download best 4 mre offers on,1
116,0,"flipkart launches a fun, social way to shop with friends on flipkart",1
117,3,rt all right  dev team has some some amazing stuff with  lightening fast data transfers and les…,1
118,1,smashwords and flipkart to end distribution relationship - amazon scores victory,-1
119,0,earn  and  vouchers for answering        surveys on join at,1
120,2,is this a good choice for nexus 5 charging cable? please suggest if any better options,0
121,3,"rt five  egv, five winners for a new rt if you're excited and ready for win? 

 w…",1
122,1,rt flipkart ping is probably one of the first game changing innovation coming from an indian tech startup.,1
123,0,"join ama - i'm amod malviya, former cto, flipkart . ask me anything! on",1
124,1,5 amazing flipkart vouchers for our,1
125,0,"i had offer of 80% off on flipcover while ordering samsung j7, now offer has been modified by u to 40%",-1
126,1,head of learning at flipkart. now that's an interesting role in an e-commerce organization. any idea of da role sir?,1
127,0,focussed on mobility; no timeline to go flipkart -,-1
128,0,i orderded a mouse yesterday for 655rs. and u'r selling it now at 599.. do cancel my old order and confirm my new,0
129,1,e560 multi-function inkjet printer is selling cheaper at inr 5698 today,1
130,-1,"hey folks, why is it, hard to find your email address on your webpage, need to check something on our recent delivery. plz reply",-1
131,0,hey can you please invite me to the flipkart ping!,0
132,0,flipkart launches ‘ping’- a new ‘social shopping’ experience on the flipkart app,1
133,0,launches ‘ping’- a new ‘social shopping’ experience on the flipkart app,1
134,1,"just bought glucometer strips. wins over , and even what…",1
135,1,awesome move!!! wants to make mobile shopping a more social experience…,1
136,-1,flipkart what is wrong with you people?!,-1
137,1,latest update of make new n innovative but they forgot to solve the al…,-1
138,1,at best price …,1
139,0,... what else.... here comes the ping... lol... shop chat.…,0
140,1,this is something interesting keep it on guys ... flipkart is inn…,1
141,-1,why dumped only policy? …,0
142,0,adds social layer to its with,1
143,-1,"pricetrak eurekaforbes pathetic brand, neither buy it nor sell it",-1
144,1,at best price ever offers here,1
145,0,launches ‘ping’- a new ‘social shopping’ experience on the flipkart app …,1
146,0,latest mobiles phone with price via,1
147,1,"yes, time is not ripe to go for app only model for companies like flipkart",-1
148,0,"rt  from last 16 days (from 7th aug) i m waiting for my order to get delivered.
when the delivery date given by you …",-1
149,0,"rt  please change your tagline from
ab har wish hogi puri
to
ab har wish rahegi adhuri

because you don't care abt y…",-1
150,0,"rt  i think on 7th aug 2015, i made a big mistake by placing an order during your freedom sale.",-1
151,0,flipkart ping brings social networking into online,1
152,0,rt tiwariamit784 rt focused on but no timeline to go flipk…,-1
153,0,"-&gt; discover flipkart offers, coupon codes at",1
154,2,sorry for trolling. love you flipkart. your delivery service is also very fast like your assistance service,1
155,1,hey flipkart i am buying laptop tommorow ! any discount from any specific card or using app ? let me know fast,0
156,2,"rt the contest continues! here’s our next task. shoot, share &amp;
win a dslr, cool cams &amp; selfie sticks!",1
157,0,rt adds social layer to its with,1
158,2,flipkart working to gain mastery over artificial co-founder sachin bansal,1
159,0,"hi!! i was just telling  that they uses the same kind of invites for their ping.. 
cheers",0
160,0,u need sum1 frm ur ecom team to guide u..ur mentioning snapdeal n pasting link of flipkart...may b  can help.,-1
161,0,flipkart moto g 3rd gen. offers &amp; coupons august 2015,1
162,0,\flipkart is bridging the gap between e-commerce and commerce,1
163,0,"rt shopping was never so easy! shop anytime, anywhere on the flipkart mobile app!",1
164,1,if u want to buy a new smart phone buy it now at,0
165,0,"buy j7(gold, 16  at",0
166,0,earn          and  vouchers for answering surveys on join at,1
167,1,audio technica ath-m40x over-the-ear headphones is selling cheaper at inr 6141 today,1
168,1,pkss 1.2 1.2 electric kettle is selling cheaper at inr 1164 today,1
169,0,retweet_count,0
170,2,"rt  participate in our \all is well with hifi\\ &amp; win flipkart egv's by answering simple questions! rt please""",1
171,2,"rt  participate in our \all is well with hifi\\ &amp; win flipkart egv's by answering simple questions! rt p…\""""",1
172,2,"rt  participate in our \all is well with hifi\\ &amp; win flipkart egv's by answering simple questions! rt plea…\""""",1
173,2,"rt  participate in our \all is well with hifi\\ &amp; win flipkart egv's by answering simple questions! rt pleas…\""""",1
174,2,"rt  participate in our \all is well with hifi\\ &amp; win flipkart egv's by answering simple questions! rt pl…\""""",1
175,2,"rt  participate in our \all is well with hifi\\ &amp; win flipkart egv's by answering simple questions! rt please …\""""",1
176,2,"rt  participate in our \all is well with hifi\\ &amp; win flipkart egv's by answering simple questions! rt ple…\""""",1
177,1,rt wow!  is the world's 2nd largest bookseller and only indian in the top 10,1
178,0,etretail | focussed on mobility but no timeline to go flipkart,-1
179,0,do you have an invite for please send me one.,0
180,0,earn  and  vouchers for answering surveys on         join at,1
181,2,"rt  participate in our \all is well with hifi\\ &amp; win flipkart egv's by answering simple questions! rt please…\""""",1
182,2,cooler master nse-300-kkn2 mid tower cabinet is selling cheaper at inr 3694 today,1
183,1,top 10 online bookstores in the world.,1
184,0,rt flipkart introduces chat feature on app with ping,1
185,0,"flipkart to hire 12,000 people this year to expand operations -",1
186,1,buy flipkart gv worth rs 4000 and get gv of rs 250 at flipkart app,1
187,0,this is a re-verification campaign to increase the security of your flipkart account.,1
188,0,latest script to buy lenovo k3 note in flipkart flash sale - sriraman,0
189,0,flipkart app now allows you to have real-time chat with flipkart has introduced a new in-app feature ...,1
190,1,denim musk deodorant roll-on  -  for men is selling cheaper at inr 215 today,1
191,1,rt conquer gaming. samsung with 4g for multi-player gaming.now available on flipkart. …,1
192,1,eta0u80ibeginu battery charger is selling cheaper at inr 138 today,1
193,0,online retail company flipkart launches in-app chat feature called ping today,1
194,0,earn  and  vouchers for answering surveys on join         at,1
195,0,expect large e-commerce firms across globe to follow flipkart - business standard,1
196,1,american tourister zing 08 laptop backpack is selling cheaper at inr 1387 today,1
197,0,online shopping goes social with flipkart's ping -,1
198,1,standard hdmi a-a hdmi cable is selling cheaper at inr 395 today,1
199,1,really happy to see ping launch congrats to the team,1
200,1,shopping goes social with flipkart's would you like to take your friends along when you go online shoppi...,1
201,0,yes these are the flipkart product listing ads .. they are creating new ad formats to promote merchant sales,1
202,1,"this is the reason why  is leader and shopping app   
great job",1
203,0,"i ask to you 1question to all flipkart senior why your delivery boy &amp; people doing such 
gunda giri with me.",-1
204,0,"hi flipkart,

today i have receive sms for product delivery but courier boy not deliver my product yet.hence",-1
205,0,ping is good! when r u making the noise?,1
206,0,flipkart moto g 3rd gen. offers &amp; coupons august flipkart moto g 3rd gen. coupons &amp; offers flipkart surp...,1
207,1,rt smashwords and flipkart to end distribution relationship - amazon scores victory,-1
208,0,"flying fafda monster, slyandsulk   -&gt; discover flipkart offers, coupon codes at",0
209,0,premdeep_jagdev rt .flipkart is bridging gap between &amp;,1
210,1,galaxy tab 4 t331 tablet is selling cheaper at inr 19800 today,1
211,0,v 240 gb ssd internal hard drive is selling cheaper at inr 8900 today,1
212,-2,my main fault is that place order on flipkart. flipkart is a very pathetic service provider .,-1
213,1,smashwords and flipkart to end distribution relationship - amazon scores victory  via,-1
214,1,"true app
great job",1
215,1,draco design bumper case for iphone 5 5s is selling cheaper at inr 2999 today,1
216,0,rt some insights about  which has been rated no1 shopping app on android and ios.,1
217,0,power-level 1 resistance tube is selling cheaper by 8% at inr 1695 today,1
218,0,rt flipkart says 41% of indian e-commerce happens on mobile. 70% of flipkart's 50 million users shop on flipkart's app,1
219,1,sling urban photo 250  camera bag is selling cheaper at inr 3499 today,1
220,0,"i ask to you one question to all flipkart senior why your delivery boy &amp; people doing such 
gunda giri with me.",-1
221,0,overall i want to say only courier people are running not the owner of flipkart.,-1
222,0,"rt .  ,  ,  , peeyush ranjan shopping together on for a watch.",0
223,1,the prophet (english) is selling cheaper at inr 60 today,1
224,0,earn           and  vouchers for answering surveys on join at,1
225,0,"hi friend, can you please give me an invite to ?",0
226,0,india's ecommerce giant flipkart introduces social network feature - memeburn,1
227,1,v 4 v 4 headset with mic 9008 wired gaming headset is selling cheaper at inr 210 today,1
228,1,introduction to management science operations research is selling cheaper at inr 531 today,1
229,1,"on page of metal gear solid legacy collection, its having description of bioshock game.",1
230,0,"hey, check out ping! now shop with friends on flipkart invite link",1
231,1,rt drag. drop. share. 3 easy steps to social shopping with,1
232,1,glares by titan wayfarer sunglasses is selling cheaper by 2% at inr 2385 today,1
233,1,flipkart’s ‘ping’ aims towards bringing the joy of shopping with friends &amp; family back!,1
234,1,xbox 360 4 gb kinect with kinect adventures is selling cheaper at inr 24990 today,1
235,0,"cauet officiel, cauetofficiel   -&gt; discover flipkart offers, coupon codes at",1
236,0,"'curfew', 'indulge', 'lathicharge' &amp; 'sarabjit'   -&gt; discover flipkart offers, coupon codes at",1
237,0,"hey, check out ping! now shop with friends on flipkart",1
238,1,thanks for working on my revolutionary idea .....whomp,1
239,1,lumia 1520 is selling cheaper at inr 35999 today,1
240,2,smart tab 8 tablet is selling cheaper at inr 5880 today,1
241,-1,"it's really, really hard to make software to power an online ebook retailer - even when you have millions to spend",0
242,0,earn  and           vouchers for answering surveys on join at,1
243,0,thanks for working on my idea ...thanks flipkart,1
244,0,rt flipkart is about to launch something new &amp; social. stay tuned for more or tell us what it could be!,0
245,1,free rs. 250 flipkart voucher. get flipkart 250 gv on 4000 rs. gv. valid only on apps,1
246,0,new ping feature wants to make shopping more social,1
247,1,"rt interesting!
41% of online shopping comes from mobile, and india leads the system.",1
248,0,flipkart did acquire appiterate...,0
249,0,rt  ping overview in one pic,0
250,0,use this invite.,0
251,0,earn  and  vouchers          for answering surveys on join at,1
252,0,"rt lights...camera...do the 2 vouchers, gym memberships &amp; goody bags!",1
253,0,on  by ari2626 good-e-tailer -,0
254,0,please raise a return request online by logging in to your flipkart account. we'll sort it.,0
255,0,"rt advice on people management, when you taught at
 the cost of",-1
256,1,not good  !!,-1
257,0,flipkart wants to make online shopping social with ping,1
258,0,rt flipkart brings ‘ping’ for real time conversation,1
259,0,the first feature which requires mobile app only. flipkart launches ping.,1
260,0,flipkart keeps app plan on hold to assess how it will impact sales in big-ticket -,0
261,0,"rt when i grew up in india, our family had a \ration card\\. now my parents use flipkart. dizzying change in last 25 years""",0
262,0,is india number 1,1
263,0,i want to send you the screenshot in dm of flipkart invoice wherein they mention seller address. why can't you.,-1
264,0,i have shared it but i am not getting any help.,-1
265,0,india’s ecommerce giant flipkart introduces social network feature,1
266,0,flipkart launches new in-app feature that lets you ask friends what to buy in ...,1
267,0,seriously they should return money immediately if a person cancel the order! it takes 8 days why?,-1
268,0,"'bandh'   -&gt; discover flipkart offers, coupon codes at",1
269,0,rt how aims to redefine through ping,1
270,1,"flipkart launches new feature 'ping'


social commerce can be a useful extension for",1
271,1,"rt &amp; executives join hands with an angel to float a new platform for used cars, spinny v…",1
272,0,"telemarket for me by call online sellers from snapdeal,flipkart,ebay, amazon.in and get them registered…",0
273,0,"telemarket for me by call online sellers from snapdeal,flipkart,ebay, amazon.in and get…",0
274,0,"telemarket for me by call online sellers from snapdeal,flipkart,ebay, amazon.in…",0
275,0,"pantaloons, amazon, snapdeal, jabong and flipkart sale over....

nse bse sale started ..flat 20% off on all shares",-1
276,0,no long-term in or just in a fast cannibal,0
277,-1,rt  wants to be your next social network because shopping all by yourself is boring,0
278,0,"deals of the day price says rs.549, when i click it said 999rs. now its saying 790rs. within 30 seconds.. solve these issues..",-1
279,2,"why top executives are leaving startups like flipkart, snapdeal, ola",-1
280,2,an attacker called love price in india - an attacker called love online at have a look at it!,0
281,0,"the number game 
ys making sense of flipkart’s and snapdeal’s valuations through their gmv via",0
282,0,"call online sellers from snapdeal,flipkart,ebay, amazon.in and get them registered to sell their products on vyoms…",0
283,1,early-stage boom may hit follow-on rounds,1
284,1,seems to be taking the lead in some stuff for way to go..,1
285,-1,now why would flipkart name its social network ping when there's already a failed social network with the same name,-1
286,0,"ws retail still selling at 549.. when clicking buy now, it redirects me to cart.. but then shows \no item on cart\\\""""",-1
287,0,"telemarket for me  by vyomshop call online sellers from snapdeal,flipkart,ebay, amazon.in and get them registered …",0
288,2,"why top executives are leaving startups like flipkart, snapdeal, ola &amp; others - the economic times",-1
289,1,"just a little finishing touches needed, but the k3 note is almost ready for today's sale on",1
290,0,hey hi guys can i have an invite for the same...,0
291,1,ddr3 4 gb(1 x 4gb) pc ram (cmv4gx3m1a1600c11) is selling cheaper at inr 1709 today,1
292,1,"rt just a little finishing touches needed, but the k3 note is almost ready for today's sale on",1
293,-1,this type of cheating not expected from   for info to,-1
294,1,samsung galaxy j5 and j7 starting at rs.11999 exciting offers- sale at flipkart !,1
295,1,samsung galaxy j5 and j7 starting at rs.11999 exciting offers- sale at flipkart !,1
296,0,"rt pantaloons, amazon, snapdeal, jabong and flipkart sale over....

nse bse sale started ..flat 20% 
wa",-1
297,1,"and executives join hands with an angel to float for used cars, via",1
298,2,travel blue luxury eye mask eye shade is selling cheaper at inr 224 today,1
299,1,"rt and executives join hands with an angel to float for used cars, …",1
300,-1,mock test paper for,0
301,0,flat 50% off on home sofas- big sale at flipkart !,1
302,-2,tried flipkart's ping. good product. but i doubt it will see adaptation. too many features confuse the users and they may get overwhelmed,-1
303,0,"hey  where would v find d pics of launch event of ping held at f baar, new delhi yesterday?",0
304,0,"rt the number game 
ys making sense of flipkart’s and snapdeal’s valuations through their gmv vi…",0
305,1,"- buy flipkart gv worth rs 4000 and get gv of rs 250 at flipkart app -- flipkart -- rs. 3750.0 -- gifting, stationery &amp; office…",1
306,0,etcio | how flipkart’s ping aims to redefine e-commerce through the messenger,1
307,0,"etbrandequity | flipkart's up for a chat, introduces ping messenger for mobile app",1
308,0,flipkart app gets an add-on chat ping,1
309,0,rt flipkart app gets an add-on chat ping,1
310,-1,"rt shopping now is very isolated experience,   is bringing new product called  where u can do soc…",-1
311,-1,where is my flipkart voucher that i won. hope u are not cheating on twitter,-1
312,-1,you guys sell shit! sell defective phones over  !,-1
313,-1,thanks flipkart  for spoiling the rakhi festival! you took 8 days to revert on the order,-1
314,0,an year back i wrote about coshopping in mobile now flipkart has implemented it with ping,1
315,0,"rt the number game 
ys making sense of flipkart’s and snapdeal’s valuations through their gmv v…",0
316,0,why are you telling us on 26th when the rakhi is just two days away!,-1
317,0,"flipkart launches new feature 'ping'

 -via inshorts",1
318,2,very interesting and innovative thing by flipkart no need to leave app to discuss any products with friends. cool..,1
319,0,"now \ping\\ your friends before buying""",0
320,1,flipkart e-gift vouchers rs.250 free on rs. 4000 (on app),1
